Cites,Authors,Title,Year,Source,Publisher,ArticleURL,CitesURL,GSRank,QueryDate,Type,DOI,ISSN,CitationURL,Volume,Issue,StartPage,EndPage,ECC,CitesPerYear,CitesPerAuthor,AuthorCount,Age,Abstract,FullTextURL,RelatedURL
65,"A Khan, K Brohman, S Addas","The anatomy of 'fake news': Studying false messages as digital objects",2022,"… of Information Technology","journals.sagepub.com","https://journals.sagepub.com/doi/abs/10.1177/02683962211037693","https://scholar.google.com/scholar?cites=16339351595864006541&as_sdt=2005&sciodt=0,5&hl=en",2,"2024-10-04 12:17:21","","10.1177/02683962211037693","","",,,,,65,32.50,22,3,2,"… It is often assumed that deception appears in the form of or as result of bald-face lying and other forms of disinformation. However, deception can equally happen in the form or as a …","https://journals.sagepub.com/doi/pdf/10.1177/02683962211037693","https://scholar.google.com/scholar?q=related:jZ-v87QJweIJ:scholar.google.com/&scioq=source:%22journal+of+information+technology%22+%22computer+mediated+communication%22++%22deception%22&hl=en&as_sdt=0,5&as_vis=1"
47,"B Van Den Hooff…","The value of online networks of practice: the role of embeddedness and media use",2010,"… of Information …","journals.sagepub.com","https://journals.sagepub.com/doi/abs/10.1057/jit.2010.11","https://scholar.google.com/scholar?cites=7510852647963644296&as_sdt=2005&sciodt=0,5&hl=en",3,"2024-10-04 12:17:21","","10.1057/jit.2010.11","","",,,,,47,3.36,24,2,14,"This article addresses the question how networks of practice (NoPs) can create value (operationalized as their contribution to individual members’ performance) for organizations …","https://www.researchgate.net/profile/Bart-Hooff/publication/43437457_The_Value_of_Online_Networks_of_Practice_The_Role_of_Embeddedness_and_Media_Use/links/0c960528a259c22871000000/The-Value-of-Online-Networks-of-Practice-The-Role-of-Embeddedness-and-Media-Use.pdf","https://scholar.google.com/scholar?q=related:iNEsarDoO2gJ:scholar.google.com/&scioq=source:%22journal+of+information+technology%22+%22computer+mediated+communication%22++%22deception%22&hl=en&as_sdt=0,5&as_vis=1"
116,"R Clarke","Risks inherent in the digital surveillance economy: A research agenda",2019,"Journal of information technology","journals.sagepub.com","https://journals.sagepub.com/doi/abs/10.1177/0268396218815559","https://scholar.google.com/scholar?cites=1354707450564085269&as_sdt=2005&sciodt=0,5&hl=en",7,"2024-10-04 12:17:21","","10.1177/0268396218815559","","",,,,,116,23.20,116,1,5,"The digitisation of data about the world relevant to business has given rise to a new phase of digitalisation of business itself. The digitisation of data about people has linked with the …","https://journals.sagepub.com/doi/pdf/10.1177/0268396218815559","https://scholar.google.com/scholar?q=related:FYZyrT_jzBIJ:scholar.google.com/&scioq=source:%22journal+of+information+technology%22+%22computer+mediated+communication%22++%22deception%22&hl=en&as_sdt=0,5&as_vis=1"
402,"U Schultze","Embodiment and presence in virtual worlds: a review",2010,"Journal of Information Technology","journals.sagepub.com","https://journals.sagepub.com/doi/abs/10.1057/jit.2009.25","https://scholar.google.com/scholar?cites=17734147752904477484&as_sdt=2005&sciodt=0,5&hl=en",16,"2024-10-04 12:17:21","","10.1057/jit.2009.25","","",,,,,402,28.71,402,1,14,"The multimodal, 3D-graphlcal communication platforms known as virtual worlds have their historical roots In multi-user domains/dungeons (MUDs) and virtual reality (VR). Given the …","https://scholar.google.com/scholar?output=instlink&q=info:LMsp9mtZHPYJ:scholar.google.com/&hl=en&as_sdt=0,5&as_vis=1&scillfp=10032213961898371757&oi=lle","https://scholar.google.com/scholar?q=related:LMsp9mtZHPYJ:scholar.google.com/&scioq=source:%22journal+of+information+technology%22+%22computer+mediated+communication%22++%22deception%22&hl=en&as_sdt=0,5&as_vis=1"
73,"M Siering, B Clapham, O Engel…","A taxonomy of financial market manipulations: establishing trust and market integrity in the financialized economy through automated fraud detection",2017,"… Information Technology","journals.sagepub.com","https://journals.sagepub.com/doi/abs/10.1057/s41265-016-0029-z","https://scholar.google.com/scholar?cites=7803487680724276993&as_sdt=2005&sciodt=0,5&hl=en",24,"2024-10-04 12:17:21","","10.1057/s41265-016-0029-z","","",,,,,73,10.43,18,4,7,"Financial market manipulations represent a major threat to trust and market integrity in capital markets. Manipulations contribute to mispricing, market imperfections and an increase in …","https://link.springer.com/content/pdf/10.1057/s41265-016-0029-z.pdf","https://scholar.google.com/scholar?q=related:ARe1crOOS2wJ:scholar.google.com/&scioq=source:%22journal+of+information+technology%22+%22computer+mediated+communication%22++%22deception%22&hl=en&as_sdt=0,5&as_vis=1"
