Title,URL,Volume Issue,Vol Issue Year
Responsible artificial intelligence governance: A review and research framework,https://www.sciencedirect.com/science/article/pii/S0963868724000672,"Volume 34, Issue 2",June 2025
The complementary and substitutional effects of forced and emergent mechanisms in multisourcing,https://www.sciencedirect.com/science/article/pii/S0963868724000519,"Volume 34, Issue 1",March 2025
A socio-cognitive perspective of knowledge integration in digital innovation networks,https://www.sciencedirect.com/science/article/pii/S0963868724000532,"Volume 34, Issue 1",March 2025
A process model for design-oriented machine learning research in information systems,https://www.sciencedirect.com/science/article/pii/S0963868724000507,"Volume 34, Issue 1",March 2025
A knowledge-centric model for government-orchestrated digital transformation among the microbusiness sector,https://www.sciencedirect.com/science/article/pii/S0963868724000520,"Volume 34, Issue 1",March 2025
Do CEOs matter? Divergent impact of CEO power on digital and non-digital innovation,https://www.sciencedirect.com/science/article/pii/S096386872400057X,"Volume 34, Issue 1",March 2025
Unboxing maturity models: A set-theoretic perspective on e-Government configurations over time,https://www.sciencedirect.com/science/article/pii/S0963868724000568,"Volume 34, Issue 1",March 2025
Sustaining IT outsourcing performance during a systemic crisis: A configurational approach,https://www.sciencedirect.com/science/article/pii/S0963868724000544,"Volume 34, Issue 1",March 2025
Editorial Board,https://www.sciencedirect.com/science/article/pii/S0963868724000611,"Volume 33, Issue 4",December 2024
Welcome to the fourth issue of volume 33 of the Journal of Strategic Information Systems,https://www.sciencedirect.com/science/article/pii/S0963868724000490,"Volume 33, Issue 4",December 2024
Is AI a strategic IS? Reflections and opportunities for research,https://www.sciencedirect.com/science/article/pii/S0963868724000489,"Volume 33, Issue 4",December 2024
The whole of cyber defense: Syncing practice and theory,https://www.sciencedirect.com/science/article/pii/S096386872400043X,"Volume 33, Issue 4",December 2024
Four roles of physicality in digital innovation: A theoretical review,https://www.sciencedirect.com/science/article/pii/S0963868724000441,"Volume 33, Issue 4",December 2024
Digital transformation in disaster management: A literature review,https://www.sciencedirect.com/science/article/pii/S0963868724000477,"Volume 33, Issue 4",December 2024
"Harnessing the Potential of Artificial Intelligence: Affordances, Constraints, and Strategic Implications for Professional Services",https://www.sciencedirect.com/science/article/pii/S0963868724000465,"Volume 33, Issue 4",December 2024
Time to reassess data value: The many faces of data in organizations,https://www.sciencedirect.com/science/article/pii/S0963868724000453,"Volume 33, Issue 4",December 2024
Editorial Board,https://www.sciencedirect.com/science/article/pii/S0963868724000398,"Volume 33, Issue 3",September 2024
Welcome to the third issue of Volume 33 of the Journal of Strategic Information Systems,https://www.sciencedirect.com/science/article/pii/S0963868724000349,"Volume 33, Issue 3",September 2024
Digital transformation of the public sector: Designing strategic information systems,https://www.sciencedirect.com/science/article/pii/S0963868724000350,"Volume 33, Issue 3",September 2024
Fusing domain knowledge with machine learning: A public sector perspective,https://www.sciencedirect.com/science/article/pii/S0963868724000301,"Volume 33, Issue 3",September 2024
Open data platforms: Design principles for embracing outlaw innovators,https://www.sciencedirect.com/science/article/pii/S0963868724000325,"Volume 33, Issue 3",September 2024
Government-Led digital transformation in FinTech ecosystems,https://www.sciencedirect.com/science/article/pii/S0963868724000313,"Volume 33, Issue 3",September 2024
Liminal digital transformation in public sector: The case of UK policing,https://www.sciencedirect.com/science/article/pii/S0963868724000337,"Volume 33, Issue 3",September 2024
Editorial Board,https://www.sciencedirect.com/science/article/pii/S096386872400026X,"Volume 33, Issue 2",June 2024
Welcome to the second issue of Volume 33 of the Journal of Strategic Information Systems,https://www.sciencedirect.com/science/article/pii/S0963868724000222,"Volume 33, Issue 2",June 2024
Toward a better digital future: Balancing the utopic and dystopic ramifications of digitalization,https://www.sciencedirect.com/science/article/pii/S0963868724000167,"Volume 33, Issue 2",June 2024
Digital transformation requires digital resource primacy: Clarification and future research directions,https://www.sciencedirect.com/science/article/pii/S0963868724000179,"Volume 33, Issue 2",June 2024
Empowering rural micro-entrepreneurs through technoficing: A process model for mobilizing and developing indigenous knowledge,https://www.sciencedirect.com/science/article/pii/S0963868724000180,"Volume 33, Issue 2",June 2024
A relational view of how social capital contributes to effective digital transformation outcomes,https://www.sciencedirect.com/science/article/pii/S0963868724000192,"Volume 33, Issue 2",June 2024
Fostering humanistic algorithmic management: A process of enacting human-algorithm complementarity,https://www.sciencedirect.com/science/article/pii/S0963868724000209,"Volume 33, Issue 2",June 2024
Crowdsourcing for innovation: Effects of idea content and competition intensity on idea success,https://www.sciencedirect.com/science/article/pii/S0963868724000210,"Volume 33, Issue 2",June 2024
Editorial Board,https://www.sciencedirect.com/science/article/pii/S0963868724000106,"Volume 33, Issue 1",March 2024
Welcome to the first issue of Volume 33 of the Journal of Strategic Information Systems,https://www.sciencedirect.com/science/article/pii/S0963868724000064,"Volume 33, Issue 1",March 2024
Evolving strategic IS themes,https://www.sciencedirect.com/science/article/pii/S0963868724000039,"Volume 33, Issue 1",March 2024
The strategic value of DEI in the information systems discipline,https://www.sciencedirect.com/science/article/pii/S0963868724000052,"Volume 33, Issue 1",March 2024
Configuring alliance portfolios for digital innovation,https://www.sciencedirect.com/science/article/pii/S0963868723000549,"Volume 33, Issue 1",March 2024
Does adopting inner source increase job satisfaction? A social capital perspective using a mixed-methods approach,https://www.sciencedirect.com/science/article/pii/S0963868724000015,"Volume 33, Issue 1",March 2024
Strategic utilization of software patents to counteract rival penetration in the IT industry,https://www.sciencedirect.com/science/article/pii/S0963868724000027,"Volume 33, Issue 1",March 2024
Unpacking the process of conceptual leaping in the conduct of literature reviews,https://www.sciencedirect.com/science/article/pii/S0963868724000040,"Volume 33, Issue 1",March 2024
Editorial Board,https://www.sciencedirect.com/science/article/pii/S0963868723000598,"Volume 32, Issue 4",December 2023
Welcome to the fourth issue of volume 32 of the Journal of Strategic Information Systems,https://www.sciencedirect.com/science/article/pii/S0963868723000537,"Volume 32, Issue 4",December 2023
Doing strategic information systems research for public value,https://www.sciencedirect.com/science/article/pii/S0963868723000513,"Volume 32, Issue 4",December 2023
Managing historical conditions in information systems strategizing: An imprinting perspective,https://www.sciencedirect.com/science/article/pii/S0963868723000409,"Volume 32, Issue 4",December 2023
Doing good by going digital: A taxonomy of digital social innovation in the context of incumbents,https://www.sciencedirect.com/science/article/pii/S0963868723000525,"Volume 32, Issue 4",December 2023
How software as a service simultaneously affords organizational agility and inertia,https://www.sciencedirect.com/science/article/pii/S0963868723000501,"Volume 32, Issue 4",December 2023
Machine learning advice in managerial decision-making: The overlooked role of decision makers’ advice utilization,https://www.sciencedirect.com/science/article/pii/S0963868723000367,"Volume 32, Issue 4",December 2023
Editorial Board,https://www.sciencedirect.com/science/article/pii/S0963868723000446,"Volume 32, Issue 3",September 2023
Welcome to the third issue of Volume 32 of the Journal of Strategic Information Systems,https://www.sciencedirect.com/science/article/pii/S0963868723000392,"Volume 32, Issue 3",September 2023
Literature review in the generative AI era - how to make a compelling contribution,https://www.sciencedirect.com/science/article/pii/S0963868723000343,"Volume 32, Issue 3",September 2023
Ethical management of human-AI interaction: Theory development review,https://www.sciencedirect.com/science/article/pii/S0963868723000185,"Volume 32, Issue 3",September 2023
Reconceptualizing platforms in information systems research through the lens of service-dominant logic,https://www.sciencedirect.com/science/article/pii/S0963868723000379,"Volume 32, Issue 3",September 2023
The strategic value of IT-enabled self-organised collectives during crises,https://www.sciencedirect.com/science/article/pii/S0963868723000380,"Volume 32, Issue 3",September 2023
Information systems for sustainable remote workplaces,https://www.sciencedirect.com/science/article/pii/S0963868723000355,"Volume 32, Issue 3",September 2023
Publisher’s note,https://www.sciencedirect.com/science/article/pii/S0963868723000331,"Volume 32, Issue 3",September 2023
Editorial Board,https://www.sciencedirect.com/science/article/pii/S0963868723000276,"Volume 32, Issue 2",June 2023
Welcome to the second issue of Volume 32 of the Journal of Strategic Information Systems,https://www.sciencedirect.com/science/article/pii/S0963868723000239,"Volume 32, Issue 2",June 2023
DEI in the IS discipline: What can we do better?,https://www.sciencedirect.com/science/article/pii/S0963868723000215,"Volume 32, Issue 2",June 2023
The influence of project initiators’ person-to-person followership on project popularity in open source communities: The role of reach and importance,https://www.sciencedirect.com/science/article/pii/S0963868723000173,"Volume 32, Issue 2",June 2023
Business-IT alignment as a coevolution process: An empirical study,https://www.sciencedirect.com/science/article/pii/S0963868723000227,"Volume 32, Issue 2",June 2023
Can ICT enhance workplace inclusion? ICT-enabled workplace inclusion practices and a new agenda for inclusion research in Information Systems,https://www.sciencedirect.com/science/article/pii/S0963868723000197,"Volume 32, Issue 2",June 2023
Responsibly strategizing with the metaverse: Business implications and DEI opportunities and challenges,https://www.sciencedirect.com/science/article/pii/S0963868723000203,"Volume 32, Issue 2",June 2023
Editorial Board,https://www.sciencedirect.com/science/article/pii/S0963868723000082,"Volume 32, Issue 1",March 2023
Welcome to the first issue of Volume 32 of The Journal of Strategic Information Systems,https://www.sciencedirect.com/science/article/pii/S0963868723000112,"Volume 32, Issue 1",March 2023
Assessing a manuscript’s state of readiness on its journey towards publication,https://www.sciencedirect.com/science/article/pii/S0963868723000124,"Volume 32, Issue 1",March 2023
Digital new market creation by incumbent firms: A political lens on the effect of formalization on agility,https://www.sciencedirect.com/science/article/pii/S096386872300001X,"Volume 32, Issue 1",March 2023
Digital transformation in high-reliability organizations: A longitudinal study of the micro-foundations of failure,https://www.sciencedirect.com/science/article/pii/S0963868723000021,"Volume 32, Issue 1",March 2023
Digital workplace transformation: Subtraction logic as deinstitutionalising the taken-for-granted,https://www.sciencedirect.com/science/article/pii/S0963868723000033,"Volume 32, Issue 1",March 2023
The business model portfolio as a strategic tool for value creation and business performance,https://www.sciencedirect.com/science/article/pii/S0963868723000045,"Volume 32, Issue 1",March 2023
Editorial Board,https://www.sciencedirect.com/science/article/pii/S0963868722000488,"Volume 31, Issue 4",December 2022
Welcome to this 4th issue of Volume 31 of The Journal of Strategic Information Systems,https://www.sciencedirect.com/science/article/pii/S0963868722000439,"Volume 31, Issue 4",December 2022
Ruminations of an Editor-in-Chief,https://www.sciencedirect.com/science/article/pii/S0963868722000427,"Volume 31, Issue 4",December 2022
Pathways to digital business models: The connection of sensing and seizing in business model innovation,https://www.sciencedirect.com/science/article/pii/S0963868722000385,"Volume 31, Issue 4",December 2022
Firm diversity and data breach risk: A longitudinal study,https://www.sciencedirect.com/science/article/pii/S0963868722000397,"Volume 31, Issue 4",December 2022
Resourcing with data: Unpacking the process of creating data-driven value propositions,https://www.sciencedirect.com/science/article/pii/S0963868722000403,"Volume 31, Issue 4",December 2022
Creating business value with process mining,https://www.sciencedirect.com/science/article/pii/S0963868722000415,"Volume 31, Issue 4",December 2022
Editorial Board,https://www.sciencedirect.com/science/article/pii/S096386872200035X,"Volume 31, Issue 3",September 2022
A taxonomy of scaling agility,https://www.sciencedirect.com/science/article/pii/S0963868722000178,"Volume 31, Issue 3",September 2022
Shifting ML value creation mechanisms: A process model of ML value creation,https://www.sciencedirect.com/science/article/pii/S0963868722000300,"Volume 31, Issue 3",September 2022
From information systems resources to effective use: Moderating effect of network embeddedness,https://www.sciencedirect.com/science/article/pii/S0963868722000312,"Volume 31, Issue 3",September 2022
Orchestrating the digital transformation of a business ecosystem,https://www.sciencedirect.com/science/article/pii/S0963868722000294,"Volume 31, Issue 3",September 2022
Editorial Board,https://www.sciencedirect.com/science/article/pii/S0963868722000245,June 2022,June 2022
Welcome to this 2nd issue of Volume 31 of The Journal of Strategic Information Systems,https://www.sciencedirect.com/science/article/pii/S0963868722000191,June 2022,June 2022
The JSIS annual review issue: A case of swift institutionalization,https://www.sciencedirect.com/science/article/pii/S096386872200018X,June 2022,June 2022
Information Technology–Supported value Co-Creation and Co-Destruction via social interaction and resource integration in service systems,https://www.sciencedirect.com/science/article/pii/S0963868722000154,June 2022,June 2022
Strategic innovation through outsourcing – A theoretical review,https://www.sciencedirect.com/science/article/pii/S0963868722000142,June 2022,June 2022
"Digital strategizing: An assessing review, definition, and research agenda",https://www.sciencedirect.com/science/article/pii/S0963868722000166,June 2022,June 2022
Immersive virtual reality in the age of the Metaverse: A hybrid-narrative review based on the technology affordance perspective,https://www.sciencedirect.com/science/article/pii/S0963868722000130,June 2022,June 2022
Editorial Board,https://www.sciencedirect.com/science/article/pii/S0963868722000099,"Volume 31, Issue 1",March 2022
Welcome to this 1st issue of volume 31 of The Journal of Strategic Information Systems,https://www.sciencedirect.com/science/article/pii/S0963868722000051,"Volume 31, Issue 1",March 2022
Disciplined autonomy: How business analytics complements customer involvement for digital innovation,https://www.sciencedirect.com/science/article/pii/S0963868722000026,"Volume 31, Issue 1",March 2022
Digital at the edge – antecedents and performance effects of boundary resource deployment,https://www.sciencedirect.com/science/article/pii/S096386872200004X,"Volume 31, Issue 1",March 2022
Strategic roles of IT modernization and cloud migration in reducing cybersecurity risks of organizations: The case of U.S. federal government,https://www.sciencedirect.com/science/article/pii/S0963868722000038,"Volume 31, Issue 1",March 2022
When and why technology leadership enters the C-suite: An antecedents perspective on CIO presence,https://www.sciencedirect.com/science/article/pii/S0963868722000014,"Volume 31, Issue 1",March 2022
Editorial Board,https://www.sciencedirect.com/science/article/pii/S0963868721000482,December 2021,December 2021
Welcome to this 4th issue of Volume 30 of The Journal of Strategic Information Systems,https://www.sciencedirect.com/science/article/pii/S0963868721000445,December 2021,December 2021
The role of IT in organizational innovation – A systematic literature review,https://www.sciencedirect.com/science/article/pii/S0963868721000433,December 2021,December 2021
Opening organizational learning in crisis management: On the affordances of social media,https://www.sciencedirect.com/science/article/pii/S0963868721000391,December 2021,December 2021
Information systems security research agenda: Exploring the gap between research and practice,https://www.sciencedirect.com/science/article/pii/S0963868721000408,December 2021,December 2021
Exploring the boundaries and processes of digital platforms for knowledge work: A review of information systems research,https://www.sciencedirect.com/science/article/pii/S096386872100041X,December 2021,December 2021
Digital innovation: Review and novel perspective,https://www.sciencedirect.com/science/article/pii/S0963868721000421,December 2021,December 2021
Editorial Board,https://www.sciencedirect.com/science/article/pii/S0963868721000354,"Volume 30, Issue 3",September 2021
Welcome to this 3RD issue of Volume 30 of The Journal of Strategic Information Systems,https://www.sciencedirect.com/science/article/pii/S0963868721000317,"Volume 30, Issue 3",September 2021
Digital opportunities for incumbents – A resource-centric perspective,https://www.sciencedirect.com/science/article/pii/S0963868721000172,"Volume 30, Issue 3",September 2021
Sustaining collaborative software development through strategic consortium,https://www.sciencedirect.com/science/article/pii/S0963868721000184,"Volume 30, Issue 3",September 2021
Understanding and measuring formal communication quality for technology implementation: A test during the anticipation stage,https://www.sciencedirect.com/science/article/pii/S0963868721000160,"Volume 30, Issue 3",September 2021
Digital strategy aligning in SMEs: A dynamic capabilities perspective,https://www.sciencedirect.com/science/article/pii/S0963868721000299,"Volume 30, Issue 3",September 2021
We’re engaged! Following the path to a successful information management capability,https://www.sciencedirect.com/science/article/pii/S0963868721000287,"Volume 30, Issue 3",September 2021
The lifecycle of algorithmic decision-making systems: Organizational choices and ethical challenges,https://www.sciencedirect.com/science/article/pii/S0963868721000305,"Volume 30, Issue 3",September 2021
Editorial Board,https://www.sciencedirect.com/science/article/pii/S0963868721000238,"Volume 30, Issue 2",June 2021
Welcome to this 2nd issue of Volume 30 of The Journal of Strategic Information Systems,https://www.sciencedirect.com/science/article/pii/S0963868721000196,"Volume 30, Issue 2",June 2021
Relating agility and electronic integration: The role of knowledge and process coordination mechanisms,https://www.sciencedirect.com/science/article/pii/S0963868721000019,"Volume 30, Issue 2",June 2021
SISP as practice: De-isolating SISP activity across multiple levels,https://www.sciencedirect.com/science/article/pii/S0963868721000056,"Volume 30, Issue 2",June 2021
The impact of structure and flux of corporate boards on organizational performance: A perspective from the information technology industry,https://www.sciencedirect.com/science/article/pii/S0963868721000147,"Volume 30, Issue 2",June 2021
Realizing value from shadow analytics: A case study,https://www.sciencedirect.com/science/article/pii/S0963868721000159,"Volume 30, Issue 2",June 2021
Editorial Board,https://www.sciencedirect.com/science/article/pii/S096386872100010X,"Volume 30, Issue 1",March 2021
Welcome to this 1st issue of Volume 30 of The Journal of Strategic Information Systems,https://www.sciencedirect.com/science/article/pii/S0963868721000068,"Volume 30, Issue 1",March 2021
Examining interdependence between product users and employees in online user communities: The role of employee-generated content,https://www.sciencedirect.com/science/article/pii/S0963868721000044,"Volume 30, Issue 1",March 2021
The nature of IT use in temporary organizations,https://www.sciencedirect.com/science/article/pii/S0963868721000020,"Volume 30, Issue 1",March 2021
Strategic innovation in IT outsourcing: Exploring the differential and interaction effects of contractual and relational governance mechanisms,https://www.sciencedirect.com/science/article/pii/S0963868721000032,"Volume 30, Issue 1",March 2021
The contingent role of interproject connectedness in cultivating open source software projects,https://www.sciencedirect.com/science/article/pii/S0963868720300068,"Volume 30, Issue 1",March 2021
Editorial Board,https://www.sciencedirect.com/science/article/pii/S0963868720300548,December 2020,December 2020
Welcome to this 4th issue of Volume 29 of The Journal of Strategic Information Systems,https://www.sciencedirect.com/science/article/pii/S0963868720300482,December 2020,December 2020
Crowdsourcing as a strategic IS sourcing phenomenon: Critical review and insights for future research,https://www.sciencedirect.com/science/article/pii/S0963868720300019,December 2020,December 2020
The strategic impacts of Intelligent Automation for knowledge and service work: An interdisciplinary review,https://www.sciencedirect.com/science/article/pii/S0963868720300081,December 2020,December 2020
Literature review: Understanding information systems strategy in the digital age,https://www.sciencedirect.com/science/article/pii/S0963868720300500,December 2020,December 2020
Human resource management and its impact on strategic business-IT alignment: A literature review and avenues for future research,https://www.sciencedirect.com/science/article/pii/S0963868720300494,December 2020,December 2020
Editorial Board,https://www.sciencedirect.com/science/article/pii/S0963868720300457,"Volume 29, Issue 3",September 2020
The past and future of The Journal of Strategic Information Systems: A conversation with Bob Galliers,https://www.sciencedirect.com/science/article/pii/S0963868720300202,"Volume 29, Issue 3",September 2020
Effectual tactics in digital intrapreneurship: A process model,https://www.sciencedirect.com/science/article/pii/S0963868720300251,"Volume 29, Issue 3",September 2020
Accomplishing the layered modular architecture in digital innovation: The case of the car’s driver information module,https://www.sciencedirect.com/science/article/pii/S0963868720300299,"Volume 29, Issue 3",September 2020
Examining relational digital transformation through the unfolding of local practices of the Finnish taxi industry,https://www.sciencedirect.com/science/article/pii/S0963868720300305,"Volume 29, Issue 3",September 2020
Aligning the IT portfolio with business strategy: Evidence for complementarity of corporate and business unit alignment,https://www.sciencedirect.com/science/article/pii/S0963868720300317,"Volume 29, Issue 3",September 2020
The contribution of IT-leveraging capability for collaborative product development with suppliers,https://www.sciencedirect.com/science/article/pii/S096386872030041X,"Volume 29, Issue 3",September 2020
Editorial Board,https://www.sciencedirect.com/science/article/pii/S0963868720300354,June 2020,June 2020
Viewpoint: Information systems research strategy,https://www.sciencedirect.com/science/article/pii/S0963868720300287,June 2020,June 2020
Introduction,https://www.sciencedirect.com/science/article/pii/S0963868720300275,June 2020,June 2020
Digital work and organisational transformation: Emergent Digital/Human work configurations in modern organisations,https://www.sciencedirect.com/science/article/pii/S0963868720300263,June 2020,June 2020
The digital work of strategists: Using open strategy for organizational transformation,https://www.sciencedirect.com/science/article/pii/S0963868720300214,June 2020,June 2020
Platform drifting: When work digitalization hijacks its spirit,https://www.sciencedirect.com/science/article/pii/S0963868720300238,June 2020,June 2020
Augmenting the algorithm: Emerging human-in-the-loop work configurations,https://www.sciencedirect.com/science/article/pii/S0963868720300226,June 2020,June 2020
Balancing fluid and cemented routines in a digital workplace,https://www.sciencedirect.com/science/article/pii/S096386872030024X,June 2020,June 2020
Editorial Board,https://www.sciencedirect.com/science/article/pii/S0963868720300135,"Volume 29, Issue 1",March 2020
Welcome to this 1st issue of volume 29 of The Journal of Strategic Information Systems,https://www.sciencedirect.com/science/article/pii/S0963868720300093,"Volume 29, Issue 1",March 2020
Organizational buyers’ assimilation of B2B platforms: Effects of IT-enabled service functionality,https://www.sciencedirect.com/science/article/pii/S0963868720300056,"Volume 29, Issue 1",March 2020
Information Technology and organizational innovation: Harmonious information technology affordance and courage-based actualization,https://www.sciencedirect.com/science/article/pii/S0963868720300044,"Volume 29, Issue 1",March 2020
IOS drivers of manufacturer-supplier flexibility and manufacturer agility,https://www.sciencedirect.com/science/article/pii/S0963868720300020,"Volume 29, Issue 1",March 2020
