Title,URL,Volume Issue,Vol Issue Year
Communicational ambidexterity as a new capability to manage social media communication within organizations,https://www.sciencedirect.com/science/article/pii/S0963868715000219,Pages 45-146 (June 2015),June 2015
Linking dimensions of social media use to job performance: The role of social capital,https://www.sciencedirect.com/science/article/pii/S0963868715000190,Pages 45-146 (June 2015),June 2015
What’s in IT for employees? Understanding the relationship between use and performance in enterprise social software,https://www.sciencedirect.com/science/article/pii/S0963868715000220,Pages 45-146 (June 2015),June 2015
Business value of social media technologies: Evidence from online user innovation communities,https://www.sciencedirect.com/science/article/pii/S0963868715000244,Pages 45-146 (June 2015),June 2015
Design for social media engagement: Insights from elderly care assistance,https://www.sciencedirect.com/science/article/pii/S0963868715000232,Pages 45-146 (June 2015),June 2015
JSIS Reviewers of the Year Award - 2014,https://www.sciencedirect.com/science/article/pii/S0963868715000323,Pages 45-146 (June 2015),June 2015
Call for papers: JSIS special issue on ”The challenges and opportunities of ’datification’,https://www.sciencedirect.com/science/article/pii/S0963868715000335,Pages 45-146 (June 2015),June 2015
Outside back cover,https://www.sciencedirect.com/science/article/pii/S0963868715000311,Pages 45-146 (June 2015),June 2015
Inside front cover,https://www.sciencedirect.com/science/article/pii/S0963868715000086,"Volume 24, Issue 1",March 2015
In memoriam,https://www.sciencedirect.com/science/article/pii/S0963868715000141,"Volume 24, Issue 1",March 2015
Editorial,https://www.sciencedirect.com/science/article/pii/S0963868715000037,"Volume 24, Issue 1",March 2015
Strategic opportunities (and challenges) of algorithmic decision-making: A call for action on the long-term societal effects of ‘datification’,https://www.sciencedirect.com/science/article/pii/S0963868715000025,"Volume 24, Issue 1",March 2015
Strategies and symbolism in the adoption of organizational social networking systems,https://www.sciencedirect.com/science/article/pii/S0963868714000468,"Volume 24, Issue 1",March 2015
Handle with care: How online social network providers’ privacy policies impact users’ information sharing behavior,https://www.sciencedirect.com/science/article/pii/S0963868714000419,"Volume 24, Issue 1",March 2015
List of Reviewers 2013-2014,https://www.sciencedirect.com/science/article/pii/S0963868715000153,"Volume 24, Issue 1",March 2015
Outside back cover,https://www.sciencedirect.com/science/article/pii/S0963868715000128,"Volume 24, Issue 1",March 2015
Inside front cover,https://www.sciencedirect.com/science/article/pii/S0963868714000481,"Volume 23, Issue 4",December 2014
Editorial,https://www.sciencedirect.com/science/article/pii/S0963868714000456,"Volume 23, Issue 4",December 2014
Implications for strategic IS research of the resource-based theory of the firm: A reflection,https://www.sciencedirect.com/science/article/pii/S0963868714000444,"Volume 23, Issue 4",December 2014
How information-sharing values influence the use of information systems: An investigation in the business intelligence systems context,https://www.sciencedirect.com/science/article/pii/S0963868714000316,"Volume 23, Issue 4",December 2014
Modern information technology in an old workforce: Toward a strategic research agenda,https://www.sciencedirect.com/science/article/pii/S0963868714000432,"Volume 23, Issue 4",December 2014
How anchoring and adjusting influence citizens’ acceptance of video-mediated crime reporting: A narrative approach,https://www.sciencedirect.com/science/article/pii/S0963868714000420,"Volume 23, Issue 4",December 2014
Index,https://www.sciencedirect.com/science/article/pii/S0963868714000596,"Volume 23, Issue 4",December 2014
Outside back cover,https://www.sciencedirect.com/science/article/pii/S0963868714000584,"Volume 23, Issue 4",December 2014
Inside front cover,https://www.sciencedirect.com/science/article/pii/S096386871400033X,"Volume 23, Issue 3",September 2014
Editorial,https://www.sciencedirect.com/science/article/pii/S0963868714000304,"Volume 23, Issue 3",September 2014
Organizational responsiveness to anti-offshoring institutional pressures,https://www.sciencedirect.com/science/article/pii/S0963868714000274,"Volume 23, Issue 3",September 2014
Forced coopetition in IT multi-sourcing,https://www.sciencedirect.com/science/article/pii/S0963868714000298,"Volume 23, Issue 3",September 2014
Beyond free software: An exploration of the business value of strategic open source,https://www.sciencedirect.com/science/article/pii/S0963868714000286,"Volume 23, Issue 3",September 2014
Retaining and attracting users in social networking services: An empirical investigation of cyber migration,https://www.sciencedirect.com/science/article/pii/S0963868714000195,"Volume 23, Issue 3",September 2014
Outside back cover,https://www.sciencedirect.com/science/article/pii/S0963868714000377,"Volume 23, Issue 3",September 2014
Inside front cover,https://www.sciencedirect.com/science/article/pii/S0963868714000225,"Volume 23, Issue 2",June 2014
Editorial,https://www.sciencedirect.com/science/article/pii/S0963868714000201,"Volume 23, Issue 2",June 2014
A dynamic capabilities perspective of IS project portfolio management,https://www.sciencedirect.com/science/article/pii/S0963868714000183,"Volume 23, Issue 2",June 2014
Integrating the IS functions after mergers and acquisitions: Analyzing business-IT alignment,https://www.sciencedirect.com/science/article/pii/S0963868713000619,"Volume 23, Issue 2",June 2014
Incorporating trust-in-technology into Expectation Disconfirmation Theory,https://www.sciencedirect.com/science/article/pii/S0963868713000607,"Volume 23, Issue 2",June 2014
A strategic path to study IT use through users’ IT culture and IT needs: A mixed-method grounded theory,https://www.sciencedirect.com/science/article/pii/S0963868713000486,"Volume 23, Issue 2",June 2014
Case studies and generalization in information systems research: A critical realist perspective,https://www.sciencedirect.com/science/article/pii/S0963868713000620,"Volume 23, Issue 2",June 2014
Outside back cover,https://www.sciencedirect.com/science/article/pii/S0963868714000262,"Volume 23, Issue 2",June 2014
Inside front cover,https://www.sciencedirect.com/science/article/pii/S0963868714000110,Pages 1-92 (March 2014),March 2014
Information systems strategy as practice: Micro strategy and strategizing for IS,https://www.sciencedirect.com/science/article/pii/S0963868714000031,Pages 1-92 (March 2014),March 2014
"Information systems strategizing, organizational sub-communities, and the emergence of a sustainability strategy",https://www.sciencedirect.com/science/article/pii/S0963868713000723,Pages 1-92 (March 2014),March 2014
Site-shifting as the source of ambidexterity: Empirical insights from the field of ticketing,https://www.sciencedirect.com/science/article/pii/S096386871400002X,Pages 1-92 (March 2014),March 2014
Information systems use as strategy practice: A multi-dimensional view of strategic information system implementation and use,https://www.sciencedirect.com/science/article/pii/S0963868714000055,Pages 1-92 (March 2014),March 2014
A strategic activity model of Enterprise System implementation and use: Scaffolding fluidity,https://www.sciencedirect.com/science/article/pii/S0963868713000772,Pages 1-92 (March 2014),March 2014
Information Systems Strategy and Strategy-as-Practice: A joint agenda,https://www.sciencedirect.com/science/article/pii/S0963868714000043,Pages 1-92 (March 2014),March 2014
Outside back cover,https://www.sciencedirect.com/science/article/pii/S096386871400016X,Pages 1-92 (March 2014),March 2014
Inside front cover,https://www.sciencedirect.com/science/article/pii/S0963868713000644,"Volume 22, Issue 4",December 2013
JSIS Editorial Dec 2013,https://www.sciencedirect.com/science/article/pii/S096386871300070X,"Volume 22, Issue 4",December 2013
Towards an information systems perspective and research agenda on crowdsourcing for innovation,https://www.sciencedirect.com/science/article/pii/S0963868713000528,"Volume 22, Issue 4",December 2013
Network ties and the success of open source software development,https://www.sciencedirect.com/science/article/pii/S0963868713000474,"Volume 22, Issue 4",December 2013
Mobility at work: A typology of mobile communities of practice and contextual ambidexterity,https://www.sciencedirect.com/science/article/pii/S0963868713000395,"Volume 22, Issue 4",December 2013
Achieving offshore software development success: An empirical analysis of risk mitigation through relational norms,https://www.sciencedirect.com/science/article/pii/S0963868713000371,"Volume 22, Issue 4",December 2013
Knowledge based transactions and decision framing in Information Technology Outsourcing,https://www.sciencedirect.com/science/article/pii/S0963868713000590,"Volume 22, Issue 4",December 2013
Corrigendum to “Joint collaborative planning as a governance mechanism to strengthen the chain of IT value co-creation” [J. Strategic Inf. Syst. 21 (3) (2012) 182–200],https://www.sciencedirect.com/science/article/pii/S0963868713000735,"Volume 22, Issue 4",December 2013
Index,https://www.sciencedirect.com/science/article/pii/S096386871300067X,"Volume 22, Issue 4",December 2013
List of Reviewers 2012-2013,https://www.sciencedirect.com/science/article/pii/S0963868713000711,"Volume 22, Issue 4",December 2013
Outside back cover,https://www.sciencedirect.com/science/article/pii/S0963868713000693,"Volume 22, Issue 4",December 2013
Inside front cover,https://www.sciencedirect.com/science/article/pii/S0963868713000541,Pages 187-256 (September 2013),September 2013
Realizing the strategic potential of e-HRM,https://www.sciencedirect.com/science/article/pii/S0963868713000498,Pages 187-256 (September 2013),September 2013
Analyzing the impact of HRIS implementations on HR personnel’s job satisfaction and turnover intention,https://www.sciencedirect.com/science/article/pii/S0963868712000480,Pages 187-256 (September 2013),September 2013
Identity ambiguity and the promises and practices of hybrid e-HRM project teams,https://www.sciencedirect.com/science/article/pii/S0963868713000334,Pages 187-256 (September 2013),September 2013
Lost in translation? An actor-network approach to HRIS implementation,https://www.sciencedirect.com/science/article/pii/S0963868713000383,Pages 187-256 (September 2013),September 2013
An institutional theory perspective on e-HRM’s strategic potential in MNC subsidiaries,https://www.sciencedirect.com/science/article/pii/S0963868713000516,Pages 187-256 (September 2013),September 2013
"Envisioning E-HRM and strategic HR: Taking seriously identity, innovative practice, and service",https://www.sciencedirect.com/science/article/pii/S0963868713000504,Pages 187-256 (September 2013),September 2013
Outside back cover,https://www.sciencedirect.com/science/article/pii/S0963868713000589,Pages 187-256 (September 2013),September 2013
Inside front cover,https://www.sciencedirect.com/science/article/pii/S0963868713000413,"Volume 22, Issue 2",June 2013
Editorial,https://www.sciencedirect.com/science/article/pii/S0963868713000462,"Volume 22, Issue 2",June 2013
Action-embedded transformational leadership in self-managing global information systems development teams,https://www.sciencedirect.com/science/article/pii/S0963868713000358,"Volume 22, Issue 2",June 2013
From boundary spanning to creolization: A study of Chinese software and services outsourcing vendors,https://www.sciencedirect.com/science/article/pii/S096386871300036X,"Volume 22, Issue 2",June 2013
Explaining the adoption of grid computing: An integrated institutional theory and organizational capability approach,https://www.sciencedirect.com/science/article/pii/S0963868712000534,"Volume 22, Issue 2",June 2013
The influence of user affect in online information disclosure,https://www.sciencedirect.com/science/article/pii/S0963868713000346,"Volume 22, Issue 2",June 2013
The economic impact of cyber terrorism,https://www.sciencedirect.com/science/article/pii/S0963868712000522,"Volume 22, Issue 2",June 2013
Outside back cover,https://www.sciencedirect.com/science/article/pii/S0963868713000450,"Volume 22, Issue 2",June 2013
Inside front cover,https://www.sciencedirect.com/science/article/pii/S096386871300022X,Pages 1-102 (March 2013),March 2013
Editorial,https://www.sciencedirect.com/science/article/pii/S0963868713000309,Pages 1-102 (March 2013),March 2013
Moving closer to the fabric of organizing visions: The case of a trade show,https://www.sciencedirect.com/science/article/pii/S0963868712000546,Pages 1-102 (March 2013),March 2013
The attraction of contributors in free and open source software projects,https://www.sciencedirect.com/science/article/pii/S0963868712000340,Pages 1-102 (March 2013),March 2013
Service Management and Engineering in Information Systems Research,https://www.sciencedirect.com/science/article/pii/S0963868713000024,Pages 1-102 (March 2013),March 2013
"IT service climate, antecedents and IT service quality outcomes: Some initial evidence",https://www.sciencedirect.com/science/article/pii/S0963868712000492,Pages 1-102 (March 2013),March 2013
Using enterprise architecture analysis and interview data to estimate service response time,https://www.sciencedirect.com/science/article/pii/S0963868712000509,Pages 1-102 (March 2013),March 2013
The influence of SOA governance mechanisms on IT flexibility and service reuse,https://www.sciencedirect.com/science/article/pii/S0963868712000510,Pages 1-102 (March 2013),March 2013
Outside back cover,https://www.sciencedirect.com/science/article/pii/S0963868713000267,Pages 1-102 (March 2013),March 2013
Inside front cover,https://www.sciencedirect.com/science/article/pii/S0963868712000777,"Volume 21, Issue 4",December 2012
JSIS Editorial Dec 2012,https://www.sciencedirect.com/science/article/pii/S0963868712000868,"Volume 21, Issue 4",December 2012
Adoption of open source software in organizations: A socio-cognitive perspective,https://www.sciencedirect.com/science/article/pii/S0963868712000200,"Volume 21, Issue 4",December 2012
Strategies for software-based hybrid business models,https://www.sciencedirect.com/science/article/pii/S0963868712000248,"Volume 21, Issue 4",December 2012
"Government policy, public value and IT outsourcing: The strategic case of ASPIRE",https://www.sciencedirect.com/science/article/pii/S0963868712000558,"Volume 21, Issue 4",December 2012
Information technology investment announcements and market value in transition economies: Evidence from Warsaw Stock Exchange,https://www.sciencedirect.com/science/article/pii/S0963868712000339,"Volume 21, Issue 4",December 2012
Index,https://www.sciencedirect.com/science/article/pii/S096386871200090X,"Volume 21, Issue 4",December 2012
List of Reviewers 2011-2012,https://www.sciencedirect.com/science/article/pii/S0963868712000881,"Volume 21, Issue 4",December 2012
Outside back cover,https://www.sciencedirect.com/science/article/pii/S0963868712000819,"Volume 21, Issue 4",December 2012
"Editorial Vol. 21, Issue 3",https://www.sciencedirect.com/science/article/pii/S0963868712000352,Pages 179-256 (September 2012),September 2012
Joint collaborative planning as a governance mechanism to strengthen the chain of IT value co-creation,https://www.sciencedirect.com/science/article/pii/S096386871200011X,Pages 179-256 (September 2012),September 2012
"Firm orientation, community of practice, and Internet-enabled interfirm communication: Evidence from Chinese firms",https://www.sciencedirect.com/science/article/pii/S0963868712000327,Pages 179-256 (September 2012),September 2012
‘Orchestrating’ sustainable crowdsourcing: A characterisation of solver brokerages,https://www.sciencedirect.com/science/article/pii/S0963868712000121,Pages 179-256 (September 2012),September 2012
A multi-level investigation of information technology outsourcing,https://www.sciencedirect.com/science/article/pii/S0963868712000169,Pages 179-256 (September 2012),September 2012
The coevolution of IT innovation and copyright institutions: The development of the mobile music business in Japan and Korea,https://www.sciencedirect.com/science/article/pii/S0963868712000133,Pages 179-256 (September 2012),September 2012
Outside back cover,https://www.sciencedirect.com/science/article/pii/S0963868712000443,Pages 179-256 (September 2012),September 2012
Inside front cover,https://www.sciencedirect.com/science/article/pii/S0963868712000273,Pages 85-178 (June 2012),June 2012
Strategic information systems: Reflections and prospectives,https://www.sciencedirect.com/science/article/pii/S096386871200025X,Pages 85-178 (June 2012),June 2012
Ubiquitous IT: The case of the Boeing 787 and implications for strategic IT research,https://www.sciencedirect.com/science/article/pii/S0963868711000801,Pages 85-178 (June 2012),June 2012
Strategizing information systems-enabled organizational transformation: A transdisciplinary review and new directions,https://www.sciencedirect.com/science/article/pii/S0963868712000170,Pages 85-178 (June 2012),June 2012
"Information systems strategy: Past, present, future?",https://www.sciencedirect.com/science/article/pii/S0963868712000145,Pages 85-178 (June 2012),June 2012
How does social software change knowledge management? Toward a strategic research agenda,https://www.sciencedirect.com/science/article/pii/S0963868712000157,Pages 85-178 (June 2012),June 2012
Information systems strategy: Quo vadis?,https://www.sciencedirect.com/science/article/pii/S0963868712000182,Pages 85-178 (June 2012),June 2012
Where’s the competitive advantage in strategic information systems research? Making the case for boundary-spanning research based on the German business and information systems engineering tradition,https://www.sciencedirect.com/science/article/pii/S0963868712000194,Pages 85-178 (June 2012),June 2012
Outside back cover,https://www.sciencedirect.com/science/article/pii/S0963868712000315,Pages 85-178 (June 2012),June 2012
Inside front cover,https://www.sciencedirect.com/science/article/pii/S0963868712000054,"Volume 21, Issue 1",March 2012
Publisher’s Note,https://www.sciencedirect.com/science/article/pii/S0963868712000108,"Volume 21, Issue 1",March 2012
Celebrating 20 years of JSIS,https://www.sciencedirect.com/science/article/pii/S0963868712000212,"Volume 21, Issue 1",March 2012
Knowledge risks in organizational networks: An exploratory framework,https://www.sciencedirect.com/science/article/pii/S0963868711000552,"Volume 21, Issue 1",March 2012
Knowledge risks in organizational networks: The practice perspective,https://www.sciencedirect.com/science/article/pii/S0963868711000564,"Volume 21, Issue 1",March 2012
Factors of stickiness in transfers of know-how between MNC units,https://www.sciencedirect.com/science/article/pii/S0963868712000029,"Volume 21, Issue 1",March 2012
Informing strategic IS change: Towards a ‘meta-learning’ framework,https://www.sciencedirect.com/science/article/pii/S0963868711000795,"Volume 21, Issue 1",March 2012
Client strategies in vendor transition: A threat balancing perspective,https://www.sciencedirect.com/science/article/pii/S0963868711000783,"Volume 21, Issue 1",March 2012
Outside back cover,https://www.sciencedirect.com/science/article/pii/S0963868712000091,"Volume 21, Issue 1",March 2012
Inside front cover,https://www.sciencedirect.com/science/article/pii/S0963868711000588,"Volume 20, Issue 4",December 2011
JSIS Editorial Dec 2011,https://www.sciencedirect.com/science/article/pii/S0963868711000655,"Volume 20, Issue 4",December 2011
Alignment within the software development unit: Assessing structural and relational dimensions between developers and testers,https://www.sciencedirect.com/science/article/pii/S0963868711000175,"Volume 20, Issue 4",December 2011
Barriers to knowledge sharing and stakeholder alignment in solar energy clusters: Learning from other sectors and regions,https://www.sciencedirect.com/science/article/pii/S0963868711000187,"Volume 20, Issue 4",December 2011
Inscription of behaviour and flexible interpretation in Information Infrastructures: The case of European e-Customs,https://www.sciencedirect.com/science/article/pii/S096386871100028X,"Volume 20, Issue 4",December 2011
Value conflicts for information security management,https://www.sciencedirect.com/science/article/pii/S0963868711000394,"Volume 20, Issue 4",December 2011
"Drivers, barriers and critical success factors for ERPII implementation in supply chains: A critical analysis",https://www.sciencedirect.com/science/article/pii/S0963868711000400,"Volume 20, Issue 4",December 2011
Firm-level benefits of IT-enabled resources: A conceptual extension and an empirical assessment,https://www.sciencedirect.com/science/article/pii/S0963868711000412,"Volume 20, Issue 4",December 2011
An empirical investigation of the relationship of IS strategy with firm performance,https://www.sciencedirect.com/science/article/pii/S0963868711000503,"Volume 20, Issue 4",December 2011
Intentionality and power interplay in IS implementation: The case of an asset management firm,https://www.sciencedirect.com/science/article/pii/S0963868711000527,"Volume 20, Issue 4",December 2011
"Computer skills, non-routine tasks, and wage premium: A longitudinal study",https://www.sciencedirect.com/science/article/pii/S0963868711000515,"Volume 20, Issue 4",December 2011
Maximizing the positive influence of IT for improving organizational performance,https://www.sciencedirect.com/science/article/pii/S0963868711000539,"Volume 20, Issue 4",December 2011
Index,https://www.sciencedirect.com/science/article/pii/S0963868711000709,"Volume 20, Issue 4",December 2011
List of Reviewers 2010-2011,https://www.sciencedirect.com/science/article/pii/S0963868711000680,"Volume 20, Issue 4",December 2011
Outside back cover,https://www.sciencedirect.com/science/article/pii/S0963868711000643,"Volume 20, Issue 4",December 2011
Inside front cover,https://www.sciencedirect.com/science/article/pii/S0963868711000436,Pages 215-322 (September 2011),September 2011
Strategic enterprise information systems for global supply chain competitiveness,https://www.sciencedirect.com/science/article/pii/S0963868711000291,Pages 215-322 (September 2011),September 2011
Disintermediation of traditional chemical intermediary roles in the Electronic Business-to-Business (e-B2B) exchange world,https://www.sciencedirect.com/science/article/pii/S0963868710000727,Pages 215-322 (September 2011),September 2011
"Information technology, operational, and management competencies for supply chain agility: Findings from case studies",https://www.sciencedirect.com/science/article/pii/S0963868710000715,Pages 215-322 (September 2011),September 2011
B2B integration in global supply chains: An identification of technical integration scenarios,https://www.sciencedirect.com/science/article/pii/S0963868711000230,Pages 215-322 (September 2011),September 2011
Modeling the information completeness of object tracking systems,https://www.sciencedirect.com/science/article/pii/S0963868711000205,Pages 215-322 (September 2011),September 2011
Knowledge management in supply chain: An empirical study from France,https://www.sciencedirect.com/science/article/pii/S0963868710000661,Pages 215-322 (September 2011),September 2011
Improving inventory effectiveness in RFID-enabled global supply chain with Grey forecasting model,https://www.sciencedirect.com/science/article/pii/S0963868711000199,Pages 215-322 (September 2011),September 2011
Outside back cover,https://www.sciencedirect.com/science/article/pii/S0963868711000473,Pages 215-322 (September 2011),September 2011
Inside front cover,https://www.sciencedirect.com/science/article/pii/S096386871100031X,"Volume 20, Issue 2",June 2011
A new departure,https://www.sciencedirect.com/science/article/pii/S0963868711000266,"Volume 20, Issue 2",June 2011
An assessment of the use of Transaction Cost Theory in information technology outsourcing,https://www.sciencedirect.com/science/article/pii/S0963868711000254,"Volume 20, Issue 2",June 2011
Beyond Transaction Cost Economics: Towards an endogenous theory of Information Technology Outsourcing,https://www.sciencedirect.com/science/article/pii/S0963868711000242,"Volume 20, Issue 2",June 2011
Special section on healthcare information systems,https://www.sciencedirect.com/science/article/pii/S0963868711000278,"Volume 20, Issue 2",June 2011
Building nation-wide information infrastructures in healthcare through modular implementation strategies,https://www.sciencedirect.com/science/article/pii/S0963868711000229,"Volume 20, Issue 2",June 2011
From cacophony to harmony: A case study about the IS implementation process as an opportunity for organizational transformation at Sentara Healthcare,https://www.sciencedirect.com/science/article/pii/S0963868711000217,"Volume 20, Issue 2",June 2011
Strategic alternatives in telecare design: Developing a value-configuration-based alignment framework,https://www.sciencedirect.com/science/article/pii/S0963868710000739,"Volume 20, Issue 2",June 2011
Outside back cover,https://www.sciencedirect.com/science/article/pii/S0963868711000369,"Volume 20, Issue 2",June 2011
Inside front cover,https://www.sciencedirect.com/science/article/pii/S0963868711000084,Pages 1-122 (March 2011),March 2011
A warm welcome to Volume 20 of the Journal of Strategic Information Systems!,https://www.sciencedirect.com/science/article/pii/S0963868711000060,Pages 1-122 (March 2011),March 2011
The Greening of IT: Paradox or promise?,https://www.sciencedirect.com/science/article/pii/S0963868711000059,Pages 1-122 (March 2011),March 2011
