Title,URL,Volume Issue,Vol Issue Year
Resource-based view and competitive strategy: An integrated model of the contribution of information technology to firm performance,https://www.sciencedirect.com/science/article/pii/S0963868705000363,"Volume 15, Issue 1",March 2006
Automotive e-hubs: Exploring motivations and barriers to collaboration and interaction,https://www.sciencedirect.com/science/article/pii/S0963868705000351,"Volume 15, Issue 1",March 2006
Outside back cover,https://www.sciencedirect.com/science/article/pii/S0963868706000084,"Volume 15, Issue 1",March 2006
Inside front cover,https://www.sciencedirect.com/science/article/pii/S0963868705000703,"Volume 14, Issue 4",December 2005
Editorial,https://www.sciencedirect.com/science/article/pii/S0963868705000533,"Volume 14, Issue 4",December 2005
IT outsourcing configuration: Research into defining and designing outsourcing arrangements,https://www.sciencedirect.com/science/article/pii/S0963868705000375,"Volume 14, Issue 4",December 2005
Determinants of IS sourcing decisions: A comparative study of transaction cost theory versus the resource-based view,https://www.sciencedirect.com/science/article/pii/S0963868705000338,"Volume 14, Issue 4",December 2005
Adoption of electronic government services among business organizations in Singapore,https://www.sciencedirect.com/science/article/pii/S096386870500034X,"Volume 14, Issue 4",December 2005
Index,https://www.sciencedirect.com/science/article/pii/S0963868705000739,"Volume 14, Issue 4",December 2005
Call for papers,https://www.sciencedirect.com/science/article/pii/S0963868705000776,"Volume 14, Issue 4",December 2005
Outside back cover,https://www.sciencedirect.com/science/article/pii/S0963868705000764,"Volume 14, Issue 4",December 2005
Inside front cover,https://www.sciencedirect.com/science/article/pii/S0963868705000582,Pages 243-354 (September 2005),September 2005
Editorial,https://www.sciencedirect.com/science/article/pii/S0963868705000557,Pages 243-354 (September 2005),September 2005
"Personal innovativeness, social influences and adoption of wireless Internet services via mobile technology",https://www.sciencedirect.com/science/article/pii/S0963868705000399,Pages 243-354 (September 2005),September 2005
Strategic implications of mobile technology: A case study using Value-Focused Thinking,https://www.sciencedirect.com/science/article/pii/S0963868705000405,Pages 243-354 (September 2005),September 2005
Mobile music business in Japan and Korea: Copyright management institutions as a reverse salient,https://www.sciencedirect.com/science/article/pii/S0963868705000417,Pages 243-354 (September 2005),September 2005
Modelling corporate wireless security and privacy,https://www.sciencedirect.com/science/article/pii/S0963868705000429,Pages 243-354 (September 2005),September 2005
The role of standards in innovation and diffusion of broadband mobile services: The case of South Korea,https://www.sciencedirect.com/science/article/pii/S0963868705000430,Pages 243-354 (September 2005),September 2005
Announcement,https://www.sciencedirect.com/science/article/pii/S0963868705000648,Pages 243-354 (September 2005),September 2005
Outside back cover,https://www.sciencedirect.com/science/article/pii/S0963868705000636,Pages 243-354 (September 2005),September 2005
Inside front cover,https://www.sciencedirect.com/science/article/pii/S0963868705000454,Pages 91-242 (June 2005),June 2005
"Special Issue Part II: understanding the contextual influences on enterprise system design, implementation, use and evaluation",https://www.sciencedirect.com/science/article/pii/S0963868705000326,Pages 91-242 (June 2005),June 2005
A framework for addressing the organisational issues of enterprise systems implementation,https://www.sciencedirect.com/science/article/pii/S0963868705000302,Pages 91-242 (June 2005),June 2005
Global–local negotiations for implementing configurable packages: The power of initial organizational decisions,https://www.sciencedirect.com/science/article/pii/S0963868705000296,Pages 91-242 (June 2005),June 2005
Mandates and technology acceptance: A tale of two enterprise technologies,https://www.sciencedirect.com/science/article/pii/S0963868705000260,Pages 91-242 (June 2005),June 2005
On the interpretative flexibility of hosted ERP systems,https://www.sciencedirect.com/science/article/pii/S0963868705000314,Pages 91-242 (June 2005),June 2005
From means to ends: The transformation of ERP in a manufacturing company,https://www.sciencedirect.com/science/article/pii/S0963868705000272,Pages 91-242 (June 2005),June 2005
The dynamics of contextual forces of ERP implementation,https://www.sciencedirect.com/science/article/pii/S0963868705000284,Pages 91-242 (June 2005),June 2005
Outside back cover,https://www.sciencedirect.com/science/article/pii/S0963868705000508,Pages 91-242 (June 2005),June 2005
Inside front cover,https://www.sciencedirect.com/science/article/pii/S0963868705000181,"Volume 14, Issue 1",March 2005
Editorial,https://www.sciencedirect.com/science/article/pii/S0963868705000156,"Volume 14, Issue 1",March 2005
"Development, global futures and IS research: a polemic",https://www.sciencedirect.com/science/article/pii/S096386870400054X,"Volume 14, Issue 1",March 2005
"Power, politics and persuasion in IS evaluation: a focus on ‘relevant social groups’",https://www.sciencedirect.com/science/article/pii/S0963868704000526,"Volume 14, Issue 1",March 2005
Strategic risk positioning as sensemaking in crisis: the adoption of electronic trading at the London international financial futures and options exchange,https://www.sciencedirect.com/science/article/pii/S0963868705000028,"Volume 14, Issue 1",March 2005
A resource-based view of competitive advantage at the Port of Singapore,https://www.sciencedirect.com/science/article/pii/S096386870400037X,"Volume 14, Issue 1",March 2005
"Organizational Knowledge Systems: An Action-oriented Perspective on Organization and Information Systems, R. Magalhaes. Edward Elgar Publishing, Cheltenham, UK (2004), 272 pages, ISBN 1-84376-282-X (£65.00)",https://www.sciencedirect.com/science/article/pii/S0963868704000538,"Volume 14, Issue 1",March 2005
Outside back cover,https://www.sciencedirect.com/science/article/pii/S0963868705000235,"Volume 14, Issue 1",March 2005
Inside front cover,https://www.sciencedirect.com/science/article/pii/S0963868705000041,Pages 271-420 (December 2004),December 2004
"Understanding the contextual influences on enterprise system design, implementation, use and evaluation",https://www.sciencedirect.com/science/article/pii/S0963868704000551,Pages 271-420 (December 2004),December 2004
"Enterprise systems, knowledge transfer and power users",https://www.sciencedirect.com/science/article/pii/S0963868704000496,Pages 271-420 (December 2004),December 2004
‘Best’ for whom?: the tension between ‘best practice’ ERP packages and diverse epistemic cultures in a university context,https://www.sciencedirect.com/science/article/pii/S0963868704000472,Pages 271-420 (December 2004),December 2004
An exploration of enterprise technology selection and evaluation,https://www.sciencedirect.com/science/article/pii/S0963868704000484,Pages 271-420 (December 2004),December 2004
"Dominant actors, political agendas, and strategic shifts over time: a critical ethnography of an enterprise systems implementation",https://www.sciencedirect.com/science/article/pii/S0963868704000502,Pages 271-420 (December 2004),December 2004
An institutional perspective on sources of ERP package–organisation misalignments,https://www.sciencedirect.com/science/article/pii/S0963868704000460,Pages 271-420 (December 2004),December 2004
Coping with ERP-related contextual issues in SMEs: a vendor's perspective,https://www.sciencedirect.com/science/article/pii/S0963868704000514,Pages 271-420 (December 2004),December 2004
Index,https://www.sciencedirect.com/science/article/pii/S0963868705000077,Pages 271-420 (December 2004),December 2004
Outside back cover,https://www.sciencedirect.com/science/article/pii/S0963868705000107,Pages 271-420 (December 2004),December 2004
Inside front cover,https://www.sciencedirect.com/science/article/pii/S096386870400040X,"Volume 13, Issue 3",September 2004
Editorial,https://www.sciencedirect.com/science/article/pii/S0963868704000381,"Volume 13, Issue 3",September 2004
"Knowledge strategy in organizations: refining the model of Hansen, Nohria and Tierney",https://www.sciencedirect.com/science/article/pii/S0963868704000368,"Volume 13, Issue 3",September 2004
Using and validating the strategic alignment model,https://www.sciencedirect.com/science/article/pii/S0963868704000356,"Volume 13, Issue 3",September 2004
De-escalation of commitment to information systems projects: a process perspective,https://www.sciencedirect.com/science/article/pii/S0963868704000344,"Volume 13, Issue 3",September 2004
Outside back cover,https://www.sciencedirect.com/science/article/pii/S0963868704000459,"Volume 13, Issue 3",September 2004
Inside front cover,https://www.sciencedirect.com/science/article/pii/S0963868704000241,Pages 87-198 (July 2004),July 2004
Strategic Information Systems in the Post-Net Era,https://www.sciencedirect.com/science/article/pii/S0963868704000125,Pages 87-198 (July 2004),July 2004
Strategies for value creation in electronic markets: towards a framework for managing evolutionary change,https://www.sciencedirect.com/science/article/pii/S0963868704000137,Pages 87-198 (July 2004),July 2004
Enterprise strategy management systems: current and next generation,https://www.sciencedirect.com/science/article/pii/S0963868704000071,Pages 87-198 (July 2004),July 2004
Seeking strategic advantage in the post-net era: viewing ERP systems from the resource-based perspective,https://www.sciencedirect.com/science/article/pii/S0963868704000058,Pages 87-198 (July 2004),July 2004
Proprietary versus internet technologies and the adoption and impact of electronic marketplaces,https://www.sciencedirect.com/science/article/pii/S096386870400006X,Pages 87-198 (July 2004),July 2004
Beyond strategic information systems: towards an IS capability,https://www.sciencedirect.com/science/article/pii/S0963868704000046,Pages 87-198 (July 2004),July 2004
Erratum to “Leveraging IT resources and capabilities at the housing and development board” [J. Strategic Inf. Syst. 12 (2003) 229–249],https://www.sciencedirect.com/science/article/pii/S0963868703000787,Pages 87-198 (July 2004),July 2004
"Call for papers: the 6th European conference on organizational knowledge, learning and capabilities (OKLC) Boston, USA, March 18-19, 2005 Hosted by Bentley College",https://www.sciencedirect.com/science/article/pii/S0963868704000307,Pages 87-198 (July 2004),July 2004
Editorial Board,https://www.sciencedirect.com/science/article/pii/S0963868704000150,"Volume 13, Issue 1",March 2004
Editorial,https://www.sciencedirect.com/science/article/pii/S0963868704000095,"Volume 13, Issue 1",March 2004
Information technology and the transformation of industries: three research perspectives,https://www.sciencedirect.com/science/article/pii/S0963868704000034,"Volume 13, Issue 1",March 2004
"IS-enabled sustainable competitive advantage in financial services, retailing and manufacturing",https://www.sciencedirect.com/science/article/pii/S0963868704000083,"Volume 13, Issue 1",March 2004
"The relationships among management accounting information, organizational learning and production performance",https://www.sciencedirect.com/science/article/pii/S0963868704000022,"Volume 13, Issue 1",March 2004
Outside back Cover,https://www.sciencedirect.com/science/article/pii/S0963868704000204,"Volume 13, Issue 1",March 2004
Editorial Board,https://www.sciencedirect.com/science/article/pii/S0963868703000696,Pages 253-398 (December 2003),December 2003
Preface,https://www.sciencedirect.com/science/article/pii/S0963868703000416,Pages 253-398 (December 2003),December 2003
The LEO principle: perspectives on 50 years of business computing,https://www.sciencedirect.com/science/article/pii/S0963868703000428,Pages 253-398 (December 2003),December 2003
LEO and the computer revolution,https://www.sciencedirect.com/science/article/pii/S096386870300043X,Pages 253-398 (December 2003),December 2003
Business computing 2001—the state of the art,https://www.sciencedirect.com/science/article/pii/S0963868703000441,Pages 253-398 (December 2003),December 2003
50 Years of business computing: LEO to Linux,https://www.sciencedirect.com/science/article/pii/S0963868703000453,Pages 253-398 (December 2003),December 2003
Conference sponsors' panel: what have we learnt in 50 years?,https://www.sciencedirect.com/science/article/pii/S0963868703000465,Pages 253-398 (December 2003),December 2003
Panel: social and economic consequences of business computing and public policy,https://www.sciencedirect.com/science/article/pii/S0963868703000477,Pages 253-398 (December 2003),December 2003
Knowledge and digital information,https://www.sciencedirect.com/science/article/pii/S0963868703000489,Pages 253-398 (December 2003),December 2003
"Panel: crystal ball, 2001-2051",https://www.sciencedirect.com/science/article/pii/S0963868703000490,Pages 253-398 (December 2003),December 2003
Looking forward fifty years—the NCC prize papers,https://www.sciencedirect.com/science/article/pii/S0963868703000507,Pages 253-398 (December 2003),December 2003
The world and business computing in 2051: from LEO to RUR?,https://www.sciencedirect.com/science/article/pii/S0963868703000519,Pages 253-398 (December 2003),December 2003
The world and business computing in 2051,https://www.sciencedirect.com/science/article/pii/S0963868703000520,Pages 253-398 (December 2003),December 2003
The world and business computing at mid-century,https://www.sciencedirect.com/science/article/pii/S0963868703000532,Pages 253-398 (December 2003),December 2003
Index,https://www.sciencedirect.com/science/article/pii/S0963868703000726,Pages 253-398 (December 2003),December 2003
Outside back cover,https://www.sciencedirect.com/science/article/pii/S0963868703000751,Pages 253-398 (December 2003),December 2003
Editorial Board,https://www.sciencedirect.com/science/article/pii/S096386870300057X,"Volume 12, Issue 3",October 2003
Publishers Note,https://www.sciencedirect.com/science/article/pii/S0963868703000544,"Volume 12, Issue 3",October 2003
Editorial,https://www.sciencedirect.com/science/article/pii/S0963868703000635,"Volume 12, Issue 3",October 2003
Technology fears: distrust and cultural persistence in electronic marketplace adoption,https://www.sciencedirect.com/science/article/pii/S0963868703000349,"Volume 12, Issue 3",October 2003
Strategic information systems planning: too little or too much?,https://www.sciencedirect.com/science/article/pii/S0963868703000398,"Volume 12, Issue 3",October 2003
Leveraging IT resources and capabilities at the housing and development board,https://www.sciencedirect.com/science/article/pii/S0963868703000404,"Volume 12, Issue 3",October 2003
"Redesigning Human Systems: Enid Mumford; Information Science Publishing, Hershey, PA, 2003, 303 pages, ISBN 1-59140-118-6 (US$79.95)",https://www.sciencedirect.com/science/article/pii/S0963868703000350,"Volume 12, Issue 3",October 2003
Outside back cover,https://www.sciencedirect.com/science/article/pii/S0963868703000623,"Volume 12, Issue 3",October 2003
Editorial Board,https://www.sciencedirect.com/science/article/pii/S0963868703000246,"Volume 12, Issue 2",July 2003
Editorial,https://www.sciencedirect.com/science/article/pii/S0963868703000222,"Volume 12, Issue 2",July 2003
Creating social and intellectual capital through IT career transitions,https://www.sciencedirect.com/science/article/pii/S0963868703000179,"Volume 12, Issue 2",July 2003
The IT contribution in developing a transnational capability at Electrolux,https://www.sciencedirect.com/science/article/pii/S0963868703000192,"Volume 12, Issue 2",July 2003
An extended platform logic perspective of IT governance: managing perceptions and activities of IT,https://www.sciencedirect.com/science/article/pii/S0963868703000210,"Volume 12, Issue 2",July 2003
"A computer called LEO: Georgina Ferry; 4th Estate, London, 2003, 221 pages, hardback, ISBN 1-84115-185 (£15.99)",https://www.sciencedirect.com/science/article/pii/S0963868703000209,"Volume 12, Issue 2",July 2003
Editorial Board,https://www.sciencedirect.com/science/article/pii/S0963868703000039,"Volume 12, Issue 1",March 2003
Connecting readers to the research information they need,https://www.sciencedirect.com/science/article/pii/S096386870300009X,"Volume 12, Issue 1",March 2003
Editorial,https://www.sciencedirect.com/science/article/pii/S0963868703000106,"Volume 12, Issue 1",March 2003
Determinants of a sustainable competitive advantage due to an IT-enabled strategy,https://www.sciencedirect.com/science/article/pii/S0963868702000355,"Volume 12, Issue 1",March 2003
The diffusion of information systems development methods,https://www.sciencedirect.com/science/article/pii/S0963868702000331,"Volume 12, Issue 1",March 2003
A conceptual model of an interorganizational intelligent meeting-scheduler (IIMS),https://www.sciencedirect.com/science/article/pii/S0963868702000343,"Volume 12, Issue 1",March 2003
Bridging communities of practice with information technology in pursuit of global knowledge sharing,https://www.sciencedirect.com/science/article/pii/S0963868702000239,"Volume 12, Issue 1",March 2003
Editorial Board,https://www.sciencedirect.com/science/article/pii/S0963868702000318,"Volume 11, Issues 3–4",December 2002
JSIS Editorial—Special Issue on “Trust in the Digital Economy”,https://www.sciencedirect.com/science/article/pii/S096386870200032X,"Volume 11, Issues 3–4",December 2002
Dynamic nature of trust in virtual teams,https://www.sciencedirect.com/science/article/pii/S0963868702000197,"Volume 11, Issues 3–4",December 2002
Institution-based trust in interorganizational exchange relationships: the role of online B2B marketplaces on trust formation,https://www.sciencedirect.com/science/article/pii/S0963868702000173,"Volume 11, Issues 3–4",December 2002
"Trustworthiness in electronic commerce: the role of privacy, security, and site attributes",https://www.sciencedirect.com/science/article/pii/S0963868702000185,"Volume 11, Issues 3–4",December 2002
Some antecedents and effects of trust in virtual communities,https://www.sciencedirect.com/science/article/pii/S0963868702000215,"Volume 11, Issues 3–4",December 2002
The impact of initial consumer trust on intentions to transact with a web site: a trust building model,https://www.sciencedirect.com/science/article/pii/S0963868702000203,"Volume 11, Issues 3–4",December 2002
"Online trust: a stakeholder perspective, concepts, implications, and future directions",https://www.sciencedirect.com/science/article/pii/S0963868702000227,"Volume 11, Issues 3–4",December 2002
Index,https://www.sciencedirect.com/science/article/pii/S0963868702000276,"Volume 11, Issues 3–4",December 2002
Editorial,https://www.sciencedirect.com/science/article/pii/S0963868702000161,"Volume 11, Issue 2",1 June 2002
The communal resource and information systems,https://www.sciencedirect.com/science/article/pii/S0963868702000069,"Volume 11, Issue 2",1 June 2002
IT alignment and firm performance in small manufacturing firms,https://www.sciencedirect.com/science/article/pii/S0963868702000070,"Volume 11, Issue 2",1 June 2002
PUZZLE: a concept and prototype for linking business intelligence to business strategy,https://www.sciencedirect.com/science/article/pii/S0963868702000057,"Volume 11, Issue 2",1 June 2002
"Exploring ASP as sourcing strategy: theoretical perspectives, propositions for practice",https://www.sciencedirect.com/science/article/pii/S0963868702000045,"Volume 11, Issue 2",1 June 2002
"M. Khosrowpour, Success and Pitfalls of Information Technology Management, Idea Group Publishing, Hershey, PA, 1999, ISBN 1-878289-56-X, US$ 165 (Book 1); M. Khosrowpour, Organizational Achievement and Failure in Information Technology Management, Idea Group Publishing, Hershey, PA, 2000, ISBN 1-878289-83-7, US$ 165 (Book 2); M. Khosrowpour, Pitfalls and Triumphs of Information Technology Management, Idea Group Publishing, Hershey, PA, 2001, ISBN 1-878289-61-6, US$ 165 (Book 3)",https://www.sciencedirect.com/science/article/pii/S0963868702000033,"Volume 11, Issue 2",1 June 2002
Editorial,https://www.sciencedirect.com/science/article/pii/S0963868702000021,"Volume 11, Issue 1",March 2002
Strategic use of the Internet and e-commerce: Cisco Systems,https://www.sciencedirect.com/science/article/pii/S0963868701000567,"Volume 11, Issue 1",March 2002
The regulation of electronic commerce: learning from the UK's RIP act,https://www.sciencedirect.com/science/article/pii/S0963868701000592,"Volume 11, Issue 1",March 2002
The role of software patents in sustaining IT-enabled competitive advantage: a call for research,https://www.sciencedirect.com/science/article/pii/S0963868701000579,"Volume 11, Issue 1",March 2002
Editorial,https://www.sciencedirect.com/science/article/pii/S0963868701000609,"Volume 10, Issue 4",December 2001
Information management (IM) strategy: the construct and its measurement,https://www.sciencedirect.com/science/article/pii/S0963868701000531,"Volume 10, Issue 4",December 2001
Managerial information system success factors within the cultural context of North America and a former Soviet Republic,https://www.sciencedirect.com/science/article/pii/S0963868701000555,"Volume 10, Issue 4",December 2001
Building outsourcing relationships across the global community: the UPS–Motorola experience,https://www.sciencedirect.com/science/article/pii/S0963868701000506,"Volume 10, Issue 4",December 2001
B2B e-Commerce in emerging economies: i-metal.com's non-ferrous metals exchange in China,https://www.sciencedirect.com/science/article/pii/S0963868701000580,"Volume 10, Issue 4",December 2001
Index of Volume,https://www.sciencedirect.com/science/article/pii/S0963868701000610,"Volume 10, Issue 4",December 2001
Editorial,https://www.sciencedirect.com/science/article/pii/S0963868701000543,"Volume 10, Issue 3",September 2001
Leveraging geographic and information technology scope for superior performance: an exploratory study in international banking,https://www.sciencedirect.com/science/article/pii/S0963868701000518,"Volume 10, Issue 3",September 2001
Sustaining strategic IT advantage in the information age: how strategy paradigms differ by speed,https://www.sciencedirect.com/science/article/pii/S096386870100052X,"Volume 10, Issue 3",September 2001
Receptivity of Singapore's SMEs to electronic commerce adoption,https://www.sciencedirect.com/science/article/pii/S0963868701000488,"Volume 10, Issue 3",September 2001
Analysts and clients in organisational contexts: a conversational perspective,https://www.sciencedirect.com/science/article/pii/S0963868701000464,"Volume 10, Issue 3",September 2001
Editorial,https://www.sciencedirect.com/science/article/pii/S096386870100049X,"Volume 10, Issue 2",June 2001
"An information technology trilogy: business strategy, technological deployment and organizational performance",https://www.sciencedirect.com/science/article/pii/S0963868701000440,"Volume 10, Issue 2",June 2001
"Information technology, strategic decision making approaches and organizational performance in different industrial settings",https://www.sciencedirect.com/science/article/pii/S0963868701000439,"Volume 10, Issue 2",June 2001
The development and exercise of power by leaders of support units in implementing information technology-based services,https://www.sciencedirect.com/science/article/pii/S0963868701000397,"Volume 10, Issue 2",June 2001
An empirical model of IT usage in the Malaysian public sector,https://www.sciencedirect.com/science/article/pii/S0963868701000476,"Volume 10, Issue 2",June 2001
JSIS Editorial Vol 10 No 1,https://www.sciencedirect.com/science/article/pii/S0963868701000452,"Volume 10, Issue 1",March 2001
How CIOs obtain peer commitment to strategic IS proposals: barriers and facilitators,https://www.sciencedirect.com/science/article/pii/S0963868701000415,"Volume 10, Issue 1",March 2001
An empirical study of misalignment between Australian CEOs and IT managers,https://www.sciencedirect.com/science/article/pii/S0963868701000403,"Volume 10, Issue 1",March 2001
Relating IT strategy and organizational culture: an empirical study of public sector units in India,https://www.sciencedirect.com/science/article/pii/S0963868701000385,"Volume 10, Issue 1",March 2001
Competing with CRS-generated information in the airline industry,https://www.sciencedirect.com/science/article/pii/S0963868701000427,"Volume 10, Issue 1",March 2001
Editorial,https://www.sciencedirect.com/science/article/pii/S0963868701000373,"Volume 9, Issue 4",December 2000
The effect of strategic alignment on the use of IS-based resources for competitive advantage,https://www.sciencedirect.com/science/article/pii/S0963868700000494,"Volume 9, Issue 4",December 2000
The need for a processual view of inter-organizational systems adoption,https://www.sciencedirect.com/science/article/pii/S0963868700000500,"Volume 9, Issue 4",December 2000
Exploring information technology outsourcing relationships: theory and practice,https://www.sciencedirect.com/science/article/pii/S0963868700000482,"Volume 9, Issue 4",December 2000
Subject Index,https://www.sciencedirect.com/science/article/pii/S096386870100035X,"Volume 9, Issue 4",December 2000
Author Index,https://www.sciencedirect.com/science/article/pii/S0963868701000361,"Volume 9, Issue 4",December 2000
Editorial,https://www.sciencedirect.com/science/article/pii/S0963868700000391,"Volume 9, Issues 2–3",September 2000
The role of AI-based technology in support of the knowledge management value activity cycle,https://www.sciencedirect.com/science/article/pii/S096386870000041X,"Volume 9, Issues 2–3",September 2000
