Title,URL,Volume Issue,Vol Issue Year
Editorial Board,https://www.sciencedirect.com/science/article/pii/S0167923609000931,"Volume 47, Issue 2",May-09
Principal–agent learning,https://www.sciencedirect.com/science/article/pii/S0167923609000098,"Volume 47, Issue 2",May-09
Towards ubiquitous information supply for individual investors: A decision support system design,https://www.sciencedirect.com/science/article/pii/S0167923609000256,"Volume 47, Issue 2",May-09
Price competition with service level guarantee in web services,https://www.sciencedirect.com/science/article/pii/S016792360900027X,"Volume 47, Issue 2",May-09
"The sustainability of B2B e-marketplaces: Ownership structure, market competition, and prior buyer–seller connections",https://www.sciencedirect.com/science/article/pii/S0167923609000281,"Volume 47, Issue 2",May-09
Financial time series forecasting using independent component analysis and support vector regression,https://www.sciencedirect.com/science/article/pii/S0167923609000323,"Volume 47, Issue 2",May-09
Impact of errors in operational spreadsheets,https://www.sciencedirect.com/science/article/pii/S0167923609000335,"Volume 47, Issue 2",May-09
Predicting and explaining the adoption of online trading: An empirical study in Taiwan,https://www.sciencedirect.com/science/article/pii/S0167923609000347,"Volume 47, Issue 2",May-09
A qualitative case study of the adoption and use of an agricultural decision support system in the Australian cotton industry: The socio-technical view,https://www.sciencedirect.com/science/article/pii/S0167923609000359,"Volume 47, Issue 2",May-09
"Encouraging information security behaviors in organizations: Role of penalties, pressures and perceived effectiveness",https://www.sciencedirect.com/science/article/pii/S0167923609000530,"Volume 47, Issue 2",May-09
Editorial Board,https://www.sciencedirect.com/science/article/pii/S0167923609000736,"Volume 47, Issue 1",Apr-09
Evolutionary approach to the development of decision support systems in the movie industry,https://www.sciencedirect.com/science/article/pii/S0167923609000025,"Volume 47, Issue 1",Apr-09
Building an automatic e-tendering system on the Semantic Web,https://www.sciencedirect.com/science/article/pii/S0167923609000037,"Volume 47, Issue 1",Apr-09
An incentive-based mechanism for transmission asset investment,https://www.sciencedirect.com/science/article/pii/S0167923609000049,"Volume 47, Issue 1",Apr-09
Neural network earnings per share forecasting models: A comparison of backward propagation and the genetic algorithm,https://www.sciencedirect.com/science/article/pii/S0167923609000050,"Volume 47, Issue 1",Apr-09
Visualization of multi-algorithm clustering for better economic decisions — The case of car pricing,https://www.sciencedirect.com/science/article/pii/S0167923609000062,"Volume 47, Issue 1",Apr-09
The application of SOM as a decision support tool to identify AACSB peer schools,https://www.sciencedirect.com/science/article/pii/S0167923609000074,"Volume 47, Issue 1",Apr-09
Improving the quality of process reference models: A quality function deployment-based approach,https://www.sciencedirect.com/science/article/pii/S0167923609000086,"Volume 47, Issue 1",Apr-09
Discussion of “The evolution of web-based optimization: From ASP to e-Services”,https://www.sciencedirect.com/science/article/pii/S0167923609000104,"Volume 47, Issue 1",Apr-09
Corrigendum to “Debiasing investors with decision support systems: An experimental investigation” [Decision Support Systems Volume (46/1) 399–410],https://www.sciencedirect.com/science/article/pii/S0167923609000116,"Volume 47, Issue 1",Apr-09
Editorial Board,https://www.sciencedirect.com/science/article/pii/S0167923609000402,"Volume 46, Issue 4,
Pages 753-912 (March 2009)",Mar-09
Introduction to the PACIS2007 special issue for decision support systems,https://www.sciencedirect.com/science/article/pii/S0167923608002170,"Volume 46, Issue 4,
Pages 753-912 (March 2009)",Mar-09
Reservation price reporting mechanisms for online negotiations,https://www.sciencedirect.com/science/article/pii/S0167923608002091,"Volume 46, Issue 4,
Pages 753-912 (March 2009)",Mar-09
Impact of piracy on innovation at software firms and implications for piracy policy,https://www.sciencedirect.com/science/article/pii/S0167923608002108,"Volume 46, Issue 4,
Pages 753-912 (March 2009)",Mar-09
Visualized cognitive knowledge map integration for P2P networks,https://www.sciencedirect.com/science/article/pii/S0167923608002169,"Volume 46, Issue 4,
Pages 753-912 (March 2009)",Mar-09
Flexible modelling and support of interrelated decisions,https://www.sciencedirect.com/science/article/pii/S0167923608002145,"Volume 46, Issue 4,
Pages 753-912 (March 2009)",Mar-09
Acceptance of agile methodologies: A critical review and conceptual framework,https://www.sciencedirect.com/science/article/pii/S0167923608002133,"Volume 46, Issue 4,
Pages 753-912 (March 2009)",Mar-09
Studying users' computer security behavior: A health belief perspective,https://www.sciencedirect.com/science/article/pii/S0167923608002157,"Volume 46, Issue 4,
Pages 753-912 (March 2009)",Mar-09
What drives continued knowledge sharing? An investigation of knowledge-contribution and -seeking beliefs,https://www.sciencedirect.com/science/article/pii/S016792360800211X,"Volume 46, Issue 4,
Pages 753-912 (March 2009)",Mar-09
How do mediated and non-mediated power affect electronic supply chain management system adoption? The mediating effects of trust and institutional pressures,https://www.sciencedirect.com/science/article/pii/S0167923608002121,"Volume 46, Issue 4,
Pages 753-912 (March 2009)",Mar-09
Identifying disgruntled employee systems fraud risk through text mining: A simple solution for a multi-billion dollar problem,https://www.sciencedirect.com/science/article/pii/S0167923608002078,"Volume 46, Issue 4,
Pages 753-912 (March 2009)",Mar-09
The business value of information technology as measured by technical efficiency: Evidence from country-level data,https://www.sciencedirect.com/science/article/pii/S0167923608002182,"Volume 46, Issue 4,
Pages 753-912 (March 2009)",Mar-09
Introducing functional classification theory to land use planning by means of decision tables,https://www.sciencedirect.com/science/article/pii/S0167923608002285,"Volume 46, Issue 4,
Pages 753-912 (March 2009)",Mar-09
Semantic Web Constraint Language and its application to an intelligent shopping agent,https://www.sciencedirect.com/science/article/pii/S0167923608002297,"Volume 46, Issue 4,
Pages 753-912 (March 2009)",Mar-09
Software project effort estimation with voting rules,https://www.sciencedirect.com/science/article/pii/S0167923608002303,"Volume 46, Issue 4,
Pages 753-912 (March 2009)",Mar-09
Understanding risk-taking behavior of groups: A “decision analysis” perspective,https://www.sciencedirect.com/science/article/pii/S0167923608002315,"Volume 46, Issue 4,
Pages 753-912 (March 2009)",Mar-09
Author index to volume 46,https://www.sciencedirect.com/science/article/pii/S0167923609000505,"Volume 46, Issue 4,
Pages 753-912 (March 2009)",Mar-09
Subject index to volume 46,https://www.sciencedirect.com/science/article/pii/S0167923609000517,"Volume 46, Issue 4,
Pages 753-912 (March 2009)",Mar-09
Editorial Board,https://www.sciencedirect.com/science/article/pii/S0167923609000153,"Volume 46, Issue 3,
Pages 605-752 (February 2009)",Feb-09
Guest editorial: Wireless in the healthcare,https://www.sciencedirect.com/science/article/pii/S0167923608002042,"Volume 46, Issue 3,
Pages 605-752 (February 2009)",Feb-09
"Enabling ubiquitous patient monitoring: Model, decision protocols, opportunities and challenges",https://www.sciencedirect.com/science/article/pii/S0167923608002030,"Volume 46, Issue 3,
Pages 605-752 (February 2009)",Feb-09
Examining the success factors for mobile work in healthcare: A deductive study,https://www.sciencedirect.com/science/article/pii/S0167923608002029,"Volume 46, Issue 3,
Pages 605-752 (February 2009)",Feb-09
Mobile technology at the frontlines of patient care: Understanding fit and human drives in utilization decisions and performance,https://www.sciencedirect.com/science/article/pii/S0167923608002017,"Volume 46, Issue 3,
Pages 605-752 (February 2009)",Feb-09
A branch-and-cut algorithm for the Winner Determination Problem,https://www.sciencedirect.com/science/article/pii/S0167923608001838,"Volume 46, Issue 3,
Pages 605-752 (February 2009)",Feb-09
Anger and flaming in computer-mediated negotiation among strangers,https://www.sciencedirect.com/science/article/pii/S0167923608001851,"Volume 46, Issue 3,
Pages 605-752 (February 2009)",Feb-09
"Media, affect, concession, and agreement in negotiation: IM versus telephone",https://www.sciencedirect.com/science/article/pii/S0167923608001863,"Volume 46, Issue 3,
Pages 605-752 (February 2009)",Feb-09
A decision support system for detecting products missing from the shelf based on heuristic rules,https://www.sciencedirect.com/science/article/pii/S016792360800198X,"Volume 46, Issue 3,
Pages 605-752 (February 2009)",Feb-09
Decision support for determining veracity via linguistic-based cues,https://www.sciencedirect.com/science/article/pii/S0167923608001991,"Volume 46, Issue 3,
Pages 605-752 (February 2009)",Feb-09
"Adaptive conceding strategies for automated trading agents in dynamic, open markets",https://www.sciencedirect.com/science/article/pii/S0167923608002005,"Volume 46, Issue 3,
Pages 605-752 (February 2009)",Feb-09
A novel approach for classifying customer complaints through graphs similarities in argumentative dialogues,https://www.sciencedirect.com/science/article/pii/S016792360800208X,"Volume 46, Issue 3,
Pages 605-752 (February 2009)",Feb-09
An evolutionary-based decision support system for vehicle routing: The case of a public utility,https://www.sciencedirect.com/science/article/pii/S0167923608002194,"Volume 46, Issue 3,
Pages 605-752 (February 2009)",Feb-09
Classification algorithm sensitivity to training data with non representative attribute noise,https://www.sciencedirect.com/science/article/pii/S0167923608002200,"Volume 46, Issue 3,
Pages 605-752 (February 2009)",Feb-09
Editorial Board,https://www.sciencedirect.com/science/article/pii/S0167923608002224,"Volume 46, Issue 2",Jan-09
Avatar e-mail versus traditional e-mail: Perceptual difference and media selection difference,https://www.sciencedirect.com/science/article/pii/S0167923607002102,"Volume 46, Issue 2",Jan-09
On the staffing policy and technology investment in a specialty hospital offering telemedicine,https://www.sciencedirect.com/science/article/pii/S0167923608001383,"Volume 46, Issue 2",Jan-09
Using domain-specific knowledge in generalization error bounds for support vector machine learning,https://www.sciencedirect.com/science/article/pii/S0167923608001425,"Volume 46, Issue 2",Jan-09
Performance evaluation for implementations of a network of proxy caches,https://www.sciencedirect.com/science/article/pii/S0167923608001437,"Volume 46, Issue 2",Jan-09
A change detection method for sequential patterns,https://www.sciencedirect.com/science/article/pii/S0167923608001449,"Volume 46, Issue 2",Jan-09
Improving supply chain performance management: A systematic approach to analyzing iterative KPI accomplishment,https://www.sciencedirect.com/science/article/pii/S0167923608001693,"Volume 46, Issue 2",Jan-09
A decision support system of dynamic vehicle refueling,https://www.sciencedirect.com/science/article/pii/S016792360800170X,"Volume 46, Issue 2",Jan-09
An application of agent-based simulation to knowledge sharing,https://www.sciencedirect.com/science/article/pii/S0167923608001711,"Volume 46, Issue 2",Jan-09
Composite quality of service and decision making perspectives in wireless networks,https://www.sciencedirect.com/science/article/pii/S0167923608001759,"Volume 46, Issue 2",Jan-09
Economic incentives to adopt electronic payment schemes under competition,https://www.sciencedirect.com/science/article/pii/S0167923608001796,"Volume 46, Issue 2",Jan-09
Communication flow orientation in business process modeling and its effect on redesign success: Results from a field study,https://www.sciencedirect.com/science/article/pii/S0167923608001802,"Volume 46, Issue 2",Jan-09
Determinants of open source software project success: A longitudinal study,https://www.sciencedirect.com/science/article/pii/S0167923608001814,"Volume 46, Issue 2",Jan-09
Identifying RFID-embedded objects in pervasive healthcare applications,https://www.sciencedirect.com/science/article/pii/S0167923608001826,"Volume 46, Issue 2",Jan-09
An admission-control technique for delay reduction in proxy caching,https://www.sciencedirect.com/science/article/pii/S016792360800184X,"Volume 46, Issue 2",Jan-09
Editorial Board,https://www.sciencedirect.com/science/article/pii/S0167923608001887,"Volume 46, Issue 1",Dec-08
A decision support system for managing inventory at GlaxoSmithKline,https://www.sciencedirect.com/science/article/pii/S016792360800078X,"Volume 46, Issue 1",Dec-08
Assisting decision making in the event-driven enterprise using wavelets,https://www.sciencedirect.com/science/article/pii/S0167923608000791,"Volume 46, Issue 1",Dec-08
Improving the peer review process with information technology,https://www.sciencedirect.com/science/article/pii/S0167923608000808,"Volume 46, Issue 1",Dec-08
Transparent Safe,https://www.sciencedirect.com/science/article/pii/S016792360800081X,"Volume 46, Issue 1",Dec-08
A new approach for a proxy-level web caching mechanism,https://www.sciencedirect.com/science/article/pii/S0167923608000857,"Volume 46, Issue 1",Dec-08
Shopbot 2.0: Integrating recommendations and promotions with comparison shopping,https://www.sciencedirect.com/science/article/pii/S0167923608000869,"Volume 46, Issue 1",Dec-08
An investigation of Zipf's Law for fraud detection (DSS#06-10-1826R(2)),https://www.sciencedirect.com/science/article/pii/S0167923608001073,"Volume 46, Issue 1",Dec-08
Policies for a single-vendor multi-buyer system with finite production rate,https://www.sciencedirect.com/science/article/pii/S0167923608001085,"Volume 46, Issue 1",Dec-08
Learning bidding strategies with autonomous agents in environments with unstable equilibrium,https://www.sciencedirect.com/science/article/pii/S0167923608001097,"Volume 46, Issue 1",Dec-08
Managing architectural emergence: A conceptual model and simulation,https://www.sciencedirect.com/science/article/pii/S0167923608001103,"Volume 46, Issue 1",Dec-08
A critical review of the literature on spreadsheet errors,https://www.sciencedirect.com/science/article/pii/S0167923608001127,"Volume 46, Issue 1",Dec-08
Transportation security decision support system for emergency response: A training prototype,https://www.sciencedirect.com/science/article/pii/S0167923608001164,"Volume 46, Issue 1",Dec-08
The implementation factors that influence the ERP (enterprise resource planning) benefits,https://www.sciencedirect.com/science/article/pii/S0167923608001176,"Volume 46, Issue 1",Dec-08
Caveat mercator in electronic commerce: An update,https://www.sciencedirect.com/science/article/pii/S0167923608001188,"Volume 46, Issue 1",Dec-08
Free/Libre Open Source Software development in developing and developed countries: A conceptual framework with an exploratory study,https://www.sciencedirect.com/science/article/pii/S016792360800119X,"Volume 46, Issue 1",Dec-08
Knowledge representation concepts for automated SLA management,https://www.sciencedirect.com/science/article/pii/S0167923608001206,"Volume 46, Issue 1",Dec-08
Physician acceptance of information technologies: Role of perceived threat to professional autonomy,https://www.sciencedirect.com/science/article/pii/S0167923608001218,"Volume 46, Issue 1",Dec-08
Facilitating relational governance through service level agreements in IT outsourcing: An application of the commitment–trust theory,https://www.sciencedirect.com/science/article/pii/S016792360800122X,"Volume 46, Issue 1",Dec-08
Identification of influencers — Measuring influence in customer networks,https://www.sciencedirect.com/science/article/pii/S0167923608001231,"Volume 46, Issue 1",Dec-08
Locking the door but leaving the computer vulnerable: Factors inhibiting home users' adoption of software firewalls,https://www.sciencedirect.com/science/article/pii/S0167923608001243,"Volume 46, Issue 1",Dec-08
A graphical shopping interface based on product attributes,https://www.sciencedirect.com/science/article/pii/S0167923608001255,"Volume 46, Issue 1",Dec-08
Multi-objective simulation optimization through search heuristics and relational database analysis,https://www.sciencedirect.com/science/article/pii/S0167923608001267,"Volume 46, Issue 1",Dec-08
Incorporating domain knowledge into data mining classifiers: An application in indirect lending,https://www.sciencedirect.com/science/article/pii/S0167923608001279,"Volume 46, Issue 1",Dec-08
Towards comprehensive support for organizational mining,https://www.sciencedirect.com/science/article/pii/S0167923608001280,"Volume 46, Issue 1",Dec-08
A survey of quantum games,https://www.sciencedirect.com/science/article/pii/S0167923608001292,"Volume 46, Issue 1",Dec-08
Real option valuation on grid computing,https://www.sciencedirect.com/science/article/pii/S0167923608001309,"Volume 46, Issue 1",Dec-08
Using Dempster–Shafer theory and real options theory to assess competing strategies for implementing IT infrastructures: A case study,https://www.sciencedirect.com/science/article/pii/S0167923608001310,"Volume 46, Issue 1",Dec-08
A middleware framework for managing transactions in group-oriented mobile commerce services,https://www.sciencedirect.com/science/article/pii/S0167923608001322,"Volume 46, Issue 1",Dec-08
A decision-support tool for a capacitated location-routing problem,https://www.sciencedirect.com/science/article/pii/S0167923608001334,"Volume 46, Issue 1",Dec-08
Decision support for optimal scheduling of highway pavement preventive maintenance within resurfacing cycle,https://www.sciencedirect.com/science/article/pii/S0167923608001346,"Volume 46, Issue 1",Dec-08
A maximum entropy approach to feature selection in knowledge-based authentication,https://www.sciencedirect.com/science/article/pii/S0167923608001358,"Volume 46, Issue 1",Dec-08
Debiasing investors with decision support systems: An experimental investigation,https://www.sciencedirect.com/science/article/pii/S016792360800136X,"Volume 46, Issue 1",Dec-08
Sales forecasting using extreme learning machine with applications in fashion retailing,https://www.sciencedirect.com/science/article/pii/S0167923608001371,"Volume 46, Issue 1",Dec-08
Detection of anomalous bids in procurement auctions,https://www.sciencedirect.com/science/article/pii/S0167923608001395,"Volume 46, Issue 1",Dec-08
Measuring interestingness of discovered skewed patterns in data cubes,https://www.sciencedirect.com/science/article/pii/S0167923608001401,"Volume 46, Issue 1",Dec-08
Determinants of online merchant rating: Content analysis of consumer comments about Yahoo merchants,https://www.sciencedirect.com/science/article/pii/S0167923608001413,"Volume 46, Issue 1",Dec-08
Editorial Board,https://www.sciencedirect.com/science/article/pii/S0167923608001619,"Volume 45, Issue 4,
Pages 663-1058 (November 2008)",Nov-08
Recent advances in information technology and systems in the Internet-era: Introduction to the WITS'05 special issue for decision support systems,https://www.sciencedirect.com/science/article/pii/S0167923607002151,"Volume 45, Issue 4,
Pages 663-1058 (November 2008)",Nov-08
Generating large-scale repositories of reusable artifacts for conceptual design of information systems,https://www.sciencedirect.com/science/article/pii/S0167923607002163,"Volume 45, Issue 4,
Pages 663-1058 (November 2008)",Nov-08
Internet-based telemedicine: An empirical investigation of objective and subjective video quality,https://www.sciencedirect.com/science/article/pii/S0167923607002175,"Volume 45, Issue 4,
Pages 663-1058 (November 2008)",Nov-08
A stack-based prospective spatio-temporal data analysis approach,https://www.sciencedirect.com/science/article/pii/S0167923607002187,"Volume 45, Issue 4,
Pages 663-1058 (November 2008)",Nov-08
Evaluating ontology mapping techniques: An experiment in public safety information sharing,https://www.sciencedirect.com/science/article/pii/S0167923607002199,"Volume 45, Issue 4,
Pages 663-1058 (November 2008)",Nov-08
Designing online selling mechanisms: Transparency levels and prices,https://www.sciencedirect.com/science/article/pii/S0167923607002205,"Volume 45, Issue 4,
Pages 663-1058 (November 2008)",Nov-08
A probabilistic model of integration,https://www.sciencedirect.com/science/article/pii/S0167923607002217,"Volume 45, Issue 4,
Pages 663-1058 (November 2008)",Nov-08
Predicting going concern opinion with data mining,https://www.sciencedirect.com/science/article/pii/S0167923608000183,"Volume 45, Issue 4,
Pages 663-1058 (November 2008)",Nov-08
Communication-Garden System: Visualizing a computer-mediated communication process,https://www.sciencedirect.com/science/article/pii/S0167923608000195,"Volume 45, Issue 4,
Pages 663-1058 (November 2008)",Nov-08
The enhancement of solving the distributed constraint satisfaction problem for cooperative supply chains using multi-agent systems,https://www.sciencedirect.com/science/article/pii/S0167923608000201,"Volume 45, Issue 4,
Pages 663-1058 (November 2008)",Nov-08
An economic mechanism for better Internet security,https://www.sciencedirect.com/science/article/pii/S0167923608000213,"Volume 45, Issue 4,
Pages 663-1058 (November 2008)",Nov-08
An exploratory study of the selection of communication media: The relationship between flow and communication outcomes,https://www.sciencedirect.com/science/article/pii/S0167923608000225,"Volume 45, Issue 4,
Pages 663-1058 (November 2008)",Nov-08
Decision support systems unfrastructure: The root problems of the management of changing IT,https://www.sciencedirect.com/science/article/pii/S0167923608000237,"Volume 45, Issue 4,
Pages 663-1058 (November 2008)",Nov-08
Online support for business processes by electronic intermediaries,https://www.sciencedirect.com/science/article/pii/S0167923608000250,"Volume 45, Issue 4,
Pages 663-1058 (November 2008)",Nov-08
Oligopolistic price competition and adverse price effect in online retailing markets,https://www.sciencedirect.com/science/article/pii/S0167923608000407,"Volume 45, Issue 4,
Pages 663-1058 (November 2008)",Nov-08
Database structure for a class of multi-period mathematical programming models,https://www.sciencedirect.com/science/article/pii/S0167923608000432,"Volume 45, Issue 4,
Pages 663-1058 (November 2008)",Nov-08
Analyzing unstructured text data: Using latent categorization to identify intellectual communities in information systems,https://www.sciencedirect.com/science/article/pii/S0167923608000444,"Volume 45, Issue 4,
Pages 663-1058 (November 2008)",Nov-08
Assessing anti-phishing preparedness: A study of online banks in Hong Kong,https://www.sciencedirect.com/science/article/pii/S0167923608000456,"Volume 45, Issue 4,
Pages 663-1058 (November 2008)",Nov-08
A data envelopment analysis method with assurance region for weight generation in the analytic hierarchy process,https://www.sciencedirect.com/science/article/pii/S0167923608000511,"Volume 45, Issue 4,
Pages 663-1058 (November 2008)",Nov-08
Improving change management in software development: Integrating traceability and software configuration management,https://www.sciencedirect.com/science/article/pii/S0167923608000523,"Volume 45, Issue 4,
Pages 663-1058 (November 2008)",Nov-08
A novel steganographic algorithm using animations as cover,https://www.sciencedirect.com/science/article/pii/S0167923608000559,"Volume 45, Issue 4,
Pages 663-1058 (November 2008)",Nov-08
A reinforcement learning model for supply chain ordering management: An application to the beer game,https://www.sciencedirect.com/science/article/pii/S0167923608000560,"Volume 45, Issue 4,
Pages 663-1058 (November 2008)",Nov-08
Extended Kalman Filter for wireless LAN based indoor positioning,https://www.sciencedirect.com/science/article/pii/S0167923608000572,"Volume 45, Issue 4,
Pages 663-1058 (November 2008)",Nov-08
The relationship between citations and number of downloads in Decision Support Systems,https://www.sciencedirect.com/science/article/pii/S0167923608000729,"Volume 45, Issue 4,
Pages 663-1058 (November 2008)",Nov-08
A framework for supporting emergency messages in wireless patient monitoring,https://www.sciencedirect.com/science/article/pii/S0167923608000730,"Volume 45, Issue 4,
Pages 663-1058 (November 2008)",Nov-08
Fashioning fair foursomes for the fairway (using a spreadsheet-based DSS as the driver),https://www.sciencedirect.com/science/article/pii/S0167923608000742,"Volume 45, Issue 4,
Pages 663-1058 (November 2008)",Nov-08
Do online reviews matter? — An empirical investigation of panel data,https://www.sciencedirect.com/science/article/pii/S0167923608000754,"Volume 45, Issue 4,
Pages 663-1058 (November 2008)",Nov-08
A socio-technical approach to business process simulation,https://www.sciencedirect.com/science/article/pii/S0167923608000766,"Volume 45, Issue 4,
Pages 663-1058 (November 2008)",Nov-08
A model to develop effective virtual teams,https://www.sciencedirect.com/science/article/pii/S0167923608000778,"Volume 45, Issue 4,
Pages 663-1058 (November 2008)",Nov-08
Task-technology fit for mobile locatable information systems,https://www.sciencedirect.com/science/article/pii/S0167923608000249,"Volume 45, Issue 4,
Pages 663-1058 (November 2008)",Nov-08
Author index to volume 45,https://www.sciencedirect.com/science/article/pii/S0167923608001735,"Volume 45, Issue 4,
Pages 663-1058 (November 2008)",Nov-08
Subject index to volume 45,https://www.sciencedirect.com/science/article/pii/S0167923608001747,"Volume 45, Issue 4,
Pages 663-1058 (November 2008)",Nov-08
