Title,URL,Volume Issue,Vol Issue Year
Mathematical modeling and Bayesian estimation for error-prone retail shelf audits,https://www.sciencedirect.com/science/article/pii/S0167923615001979,Volume 80,Dec-15
Customer integration and operational performance: The mediating role of information quality,https://www.sciencedirect.com/science/article/pii/S0167923615001955,Volume 80,Dec-15
Editorial Board,https://www.sciencedirect.com/science/article/pii/S0167923615001852,Volume 79,Nov-15
Six thinking hats: A novel metalearner for intelligent decision support in electricity markets,https://www.sciencedirect.com/science/article/pii/S0167923615001438,Volume 79,Nov-15
Can online product reviews be more helpful? Examining characteristics of information content by product type,https://www.sciencedirect.com/science/article/pii/S0167923615001414,Volume 79,Nov-15
A Bayesian approach for incorporating expert opinions into decision support systems: A case study of online consumer-satisfaction detection,https://www.sciencedirect.com/science/article/pii/S0167923615001384,Volume 79,Nov-15
A decision support system tool for the transportation by barge of import containers: A case study,https://www.sciencedirect.com/science/article/pii/S0167923615001451,Volume 79,Nov-15
"Proposing a new friend recommendation method, FRUTAI, to enhance social media providers' performance",https://www.sciencedirect.com/science/article/pii/S0167923615001402,Volume 79,Nov-15
Consumers' decisions in social commerce context: An empirical investigation,https://www.sciencedirect.com/science/article/pii/S016792361500144X,Volume 79,Nov-15
A multivariate approach for top-down project control using earned value management,https://www.sciencedirect.com/science/article/pii/S0167923615001554,Volume 79,Nov-15
Event interval analysis: Why do processes take time?,https://www.sciencedirect.com/science/article/pii/S0167923615001396,Volume 79,Nov-15
Towards a highly effective and robust Web credibility evaluation system,https://www.sciencedirect.com/science/article/pii/S0167923615001426,Volume 79,Nov-15
A novel summarization technique for the support of resolving multi-criteria decision making problems,https://www.sciencedirect.com/science/article/pii/S0167923615001578,Volume 79,Nov-15
Best-matching with interdependent preferences—implications for capacitated cluster formation and evolution,https://www.sciencedirect.com/science/article/pii/S016792361500158X,Volume 79,Nov-15
Process mining on noisy logs — Can log sanitization help to improve performance?,https://www.sciencedirect.com/science/article/pii/S0167923615001566,Volume 79,Nov-15
Consensus model for multi-criteria large-group emergency decision making considering non-cooperative behaviors and minority opinions,https://www.sciencedirect.com/science/article/pii/S0167923615001621,Volume 79,Nov-15
Risk aversion and loss aversion in core-selecting auctions,https://www.sciencedirect.com/science/article/pii/S0167923615001608,Volume 79,Nov-15
"A customer value, satisfaction, and loyalty perspective of mobile application recommendations",https://www.sciencedirect.com/science/article/pii/S016792361500161X,Volume 79,Nov-15
Small and medium sized manufacturer performance on third party B2B electronic marketplaces: The role of enabling and IT capabilities,https://www.sciencedirect.com/science/article/pii/S0167923615001591,Volume 79,Nov-15
Hybrid collaborative filtering for high-involvement products: A solution to opinion sparsity and dynamics,https://www.sciencedirect.com/science/article/pii/S0167923615001797,Volume 79,Nov-15
Editorial Board,https://www.sciencedirect.com/science/article/pii/S0167923615001657,Volume 78,Oct-15
Automated planning of process models: Design of a novel approach to construct exclusive choices,https://www.sciencedirect.com/science/article/pii/S0167923615001372,Volume 78,Oct-15
Multi-criteria analysis for OS-EMR software selection problem: A comparative study,https://www.sciencedirect.com/science/article/pii/S0167923615001347,Volume 78,Oct-15
User participation in a corporate prediction market,https://www.sciencedirect.com/science/article/pii/S0167923615001360,Volume 78,Oct-15
High-speed idea filtering with the bag of lemons,https://www.sciencedirect.com/science/article/pii/S0167923615001190,Volume 78,Oct-15
Combination of cognitive and HCI modeling for the design of KDD-based DSS used in dynamic situations,https://www.sciencedirect.com/science/article/pii/S0167923615001359,Volume 78,Oct-15
Guest editorial: Market transformation to an IT-enabled services-oriented economy,https://www.sciencedirect.com/science/article/pii/S016792361500113X,Volume 78,Oct-15
Information transparency in prediction markets,https://www.sciencedirect.com/science/article/pii/S0167923615001037,Volume 78,Oct-15
Pricing strategy for cloud computing: A damaged services perspective,https://www.sciencedirect.com/science/article/pii/S0167923614002681,Volume 78,Oct-15
Leveraging location-based services for couponing and infomediation,https://www.sciencedirect.com/science/article/pii/S0167923615001013,Volume 78,Oct-15
Loyalty programs and dynamic consumer preference in online markets,https://www.sciencedirect.com/science/article/pii/S0167923615001025,Volume 78,Oct-15
Exploring the influence of the online physician service delivery process on patient satisfaction,https://www.sciencedirect.com/science/article/pii/S0167923615001001,Volume 78,Oct-15
Editorial Board,https://www.sciencedirect.com/science/article/pii/S0167923615001475,Volume 77,Sep-15
Whom should I persuade during a negotiation? An approach based on social influence maximization,https://www.sciencedirect.com/science/article/pii/S0167923615000974,Volume 77,Sep-15
Selecting infrastructure maintenance projects with Robust Portfolio Modeling,https://www.sciencedirect.com/science/article/pii/S0167923615000858,Volume 77,Sep-15
Effects of ticket-switching on inventory management: Actual vs. information system-based data,https://www.sciencedirect.com/science/article/pii/S0167923615001049,Volume 77,Sep-15
Building and evaluating ESET: A tool for assessing the support given by an enterprise system to supply chain management,https://www.sciencedirect.com/science/article/pii/S0167923615000986,Volume 77,Sep-15
Resource allocation and revenue optimization for cloud service providers,https://www.sciencedirect.com/science/article/pii/S0167923615000792,Volume 77,Sep-15
Economic sustainability of closed loop supply chains: A holistic model for decision and policy analysis,https://www.sciencedirect.com/science/article/pii/S0167923615001128,Volume 77,Sep-15
Hidden semi-Markov model-based reputation management system for online to offline (O2O) e-commerce markets,https://www.sciencedirect.com/science/article/pii/S0167923615001141,Volume 77,Sep-15
Personalized finance advisory through case-based recommender systems and diversification strategies,https://www.sciencedirect.com/science/article/pii/S0167923615001153,Volume 77,Sep-15
Understanding continuance intentions of physicians with electronic medical records (EMR): An expectancy-confirmation perspective,https://www.sciencedirect.com/science/article/pii/S0167923615001177,Volume 77,Sep-15
Fusion Miner: Process discovery for mixed-paradigm models,https://www.sciencedirect.com/science/article/pii/S0167923615001165,Volume 77,Sep-15
The effect of prior knowledge and decision-making style on the online purchase decision-making process: A typology of consumer shopping behaviour,https://www.sciencedirect.com/science/article/pii/S0167923615001189,Volume 77,Sep-15
Evaluating user interaction with a web-based group decision support system: A comparison between two clustering methods,https://www.sciencedirect.com/science/article/pii/S0167923615001207,Volume 77,Sep-15
Editorial Board,https://www.sciencedirect.com/science/article/pii/S0167923615001220,"Volume 76,
Pages 1-86 (August 2015)",Aug-15
Introduction to the Special Issue on “Analyzing the impacts of advanced information technologies on business operations”,https://www.sciencedirect.com/science/article/pii/S0167923615000998,"Volume 76,
Pages 1-86 (August 2015)",Aug-15
On the brink: Predicting business failure with mobile location-based checkins,https://www.sciencedirect.com/science/article/pii/S0167923615000810,"Volume 76,
Pages 1-86 (August 2015)",Aug-15
An empirical study of how third-party websites influence the feedback mechanism between online Word-of-Mouth and retail sales,https://www.sciencedirect.com/science/article/pii/S0167923615000640,"Volume 76,
Pages 1-86 (August 2015)",Aug-15
Price discount and capacity planning under demand postponement with opaque selling,https://www.sciencedirect.com/science/article/pii/S0167923615000226,"Volume 76,
Pages 1-86 (August 2015)",Aug-15
The role of innovation in inventory turnover performance,https://www.sciencedirect.com/science/article/pii/S0167923615000305,"Volume 76,
Pages 1-86 (August 2015)",Aug-15
A perspective on applications of in-memory analytics in supply chain management,https://www.sciencedirect.com/science/article/pii/S0167923615000044,"Volume 76,
Pages 1-86 (August 2015)",Aug-15
Optimizing the timing and number of batches for compounded sterile products in an in-hospital pharmacy,https://www.sciencedirect.com/science/article/pii/S0167923615000330,"Volume 76,
Pages 1-86 (August 2015)",Aug-15
Hierarchical quality disclosure in a supply chain with cost heterogeneity,https://www.sciencedirect.com/science/article/pii/S0167923615000032,"Volume 76,
Pages 1-86 (August 2015)",Aug-15
Incentive information sharing in various market structures,https://www.sciencedirect.com/science/article/pii/S0167923615000573,"Volume 76,
Pages 1-86 (August 2015)",Aug-15
Editorial Board,https://www.sciencedirect.com/science/article/pii/S0167923615001062,Volume 75,Jul-15
A web recommendation system considering sequential information,https://www.sciencedirect.com/science/article/pii/S0167923615000755,Volume 75,Jul-15
OpinionRings: Inferring and visualizing the opinion tendency of socially connected users,https://www.sciencedirect.com/science/article/pii/S0167923615000780,Volume 75,Jul-15
A Decision Support System for predictive police patrolling,https://www.sciencedirect.com/science/article/pii/S0167923615000834,Volume 75,Jul-15
APATE: A novel approach for automated credit card transaction fraud detection using network-based extensions,https://www.sciencedirect.com/science/article/pii/S0167923615000846,Volume 75,Jul-15
Allocation of resources to cyber-security: The effect of misalignment of interest between managers and investors,https://www.sciencedirect.com/science/article/pii/S0167923615000822,Volume 75,Jul-15
Algorithm for the detection of outliers based on the theory of rough sets,https://www.sciencedirect.com/science/article/pii/S016792361500086X,Volume 75,Jul-15
Editorial Board,https://www.sciencedirect.com/science/article/pii/S0167923615000883,Volume 74,Jun-15
Scalable learning of probabilistic latent models for collaborative filtering,https://www.sciencedirect.com/science/article/pii/S0167923615000603,Volume 74,Jun-15
Recommender system application developments: A survey,https://www.sciencedirect.com/science/article/pii/S0167923615000627,Volume 74,Jun-15
A decision support model for long-term course planning,https://www.sciencedirect.com/science/article/pii/S0167923615000561,Volume 74,Jun-15
Polarity classification using structure-based vector representations of text,https://www.sciencedirect.com/science/article/pii/S0167923615000731,Volume 74,Jun-15
Cost-sensitive Global Model Trees applied to loan charge-off forecasting,https://www.sciencedirect.com/science/article/pii/S0167923615000639,Volume 74,Jun-15
Some extensions of the precise consistency consensus matrix,https://www.sciencedirect.com/science/article/pii/S0167923615000767,Volume 74,Jun-15
"Financial fraud detection using vocal, linguistic and financial cues",https://www.sciencedirect.com/science/article/pii/S0167923615000779,Volume 74,Jun-15
How are C-suite executives different? A comparative empirical study of the survival of American chief information officers,https://www.sciencedirect.com/science/article/pii/S0167923615000597,Volume 74,Jun-15
Do decision-making structure and sequence exist in health online social networks?,https://www.sciencedirect.com/science/article/pii/S0167923615000615,Volume 74,Jun-15
"A survey on trust and reputation models for Web services: Single, composite, and communities",https://www.sciencedirect.com/science/article/pii/S0167923615000809,Volume 74,Jun-15
A novel entropy-based decision support framework for uncertainty resolution in the initial subjective evaluations of experts: The NATO enlargement problem,https://www.sciencedirect.com/science/article/pii/S016792361500072X,Volume 74,Jun-15
Predicting overall survivability in comorbidity of cancers: A data mining approach,https://www.sciencedirect.com/science/article/pii/S0167923615000743,Volume 74,Jun-15
Editorial Board,https://www.sciencedirect.com/science/article/pii/S0167923615000664,Volume 73,May-15
Automated negotiation for e-commerce decision making: A goal deliberated agent architecture for multi-strategy selection,https://www.sciencedirect.com/science/article/pii/S0167923615000329,Volume 73,May-15
Analyzing initial public offerings' short-term performance using decision trees and SVMs,https://www.sciencedirect.com/science/article/pii/S0167923615000317,Volume 73,May-15
Voluntary information disclosure on social media,https://www.sciencedirect.com/science/article/pii/S0167923615000457,Volume 73,May-15
Combining partially independent belief functions,https://www.sciencedirect.com/science/article/pii/S0167923615000445,Volume 73,May-15
Getting the most out of third party trust seals: An empirical analysis,https://www.sciencedirect.com/science/article/pii/S0167923615000433,Volume 73,May-15
Early detection of network element outages based on customer trouble calls,https://www.sciencedirect.com/science/article/pii/S016792361500041X,Volume 73,May-15
Loyal to your city? A data mining analysis of a public service loyalty program,https://www.sciencedirect.com/science/article/pii/S0167923615000585,Volume 73,May-15
Will video be the next generation of e-commerce product reviews? Presentation format and the role of product type,https://www.sciencedirect.com/science/article/pii/S0167923615000469,Volume 73,May-15
Efficient identity matching using static pruning q-gram indexing approach,https://www.sciencedirect.com/science/article/pii/S0167923615000421,Volume 73,May-15
Editorial Board,https://www.sciencedirect.com/science/article/pii/S0167923615000482,Volume 72,Apr-15
"User acceptance of knowledge-based system recommendations: Explanations, arguments, and fit",https://www.sciencedirect.com/science/article/pii/S0167923615000251,Volume 72,Apr-15
Cost-sensitive and ensemble-based prediction model for outsourced software project risk prediction,https://www.sciencedirect.com/science/article/pii/S0167923615000238,Volume 72,Apr-15
A decision support framework to implement optimal personalized marketing interventions,https://www.sciencedirect.com/science/article/pii/S0167923615000202,Volume 72,Apr-15
Parametric evaluation of research units with respect to reference profiles,https://www.sciencedirect.com/science/article/pii/S016792361500024X,Volume 72,Apr-15
Multidimensional analysis model for a document warehouse that includes textual measures,https://www.sciencedirect.com/science/article/pii/S0167923615000287,Volume 72,Apr-15
Measuring consumers' willingness to pay with utility-based recommendation systems,https://www.sciencedirect.com/science/article/pii/S0167923615000263,Volume 72,Apr-15
Including high-cardinality attributes in predictive models: A case study in churn prediction in the energy sector,https://www.sciencedirect.com/science/article/pii/S0167923615000275,Volume 72,Apr-15
Metric-based data quality assessment — Developing and evaluating a probability-based currency metric,https://www.sciencedirect.com/science/article/pii/S0167923615000299,Volume 72,Apr-15
A semantic enhanced hybrid recommendation approach: A case study of e-Government tourism service recommendation system,https://www.sciencedirect.com/science/article/pii/S0167923615000214,Volume 72,Apr-15
Editorial Board,https://www.sciencedirect.com/science/article/pii/S0167923615000354,Volume 71,Mar-15
A decision-making methodology for low-carbon electronic product design,https://www.sciencedirect.com/science/article/pii/S0167923615000056,Volume 71,Mar-15
A framework for model integration and holistic modelling of socio-technical systems,https://www.sciencedirect.com/science/article/pii/S016792361500007X,Volume 71,Mar-15
Does director interlock impact corporate R&D investment?,https://www.sciencedirect.com/science/article/pii/S0167923615000020,Volume 71,Mar-15
Multi-faceted trust and distrust prediction for recommender systems,https://www.sciencedirect.com/science/article/pii/S0167923615000068,Volume 71,Mar-15
The effects of response strategies and severity of failure on consumer attribution with regard to negative word-of-mouth,https://www.sciencedirect.com/science/article/pii/S0167923615000172,Volume 71,Mar-15
Trust violation and repair: The information privacy perspective,https://www.sciencedirect.com/science/article/pii/S0167923615000196,Volume 71,Mar-15
Location disclosure on LB-SNAs: The role of incentives on sharing behavior,https://www.sciencedirect.com/science/article/pii/S0167923615000184,Volume 71,Mar-15
Editorial Board,https://www.sciencedirect.com/science/article/pii/S0167923615000093,Volume 70,Feb-15
Detecting short-term cyclical topic dynamics in the user-generated content and news,https://www.sciencedirect.com/science/article/pii/S0167923614002735,Volume 70,Feb-15
Do online social networks support decision-making?,https://www.sciencedirect.com/science/article/pii/S0167923614002784,Volume 70,Feb-15
Vendor managed inventory for single-vendor multi-retailer supply chains,https://www.sciencedirect.com/science/article/pii/S0167923614002802,Volume 70,Feb-15
The moderating effects of keyword competition on the determinants of ad position in sponsored search advertising,https://www.sciencedirect.com/science/article/pii/S0167923614002760,Volume 70,Feb-15
Online profiling and clustering of Facebook users,https://www.sciencedirect.com/science/article/pii/S0167923614002796,Volume 70,Feb-15
Rethinking the role of security in client satisfaction with Software-as-a-Service (SaaS) providers,https://www.sciencedirect.com/science/article/pii/S0167923614002838,Volume 70,Feb-15
Clinical implementation of a neonatal seizure detection algorithm,https://www.sciencedirect.com/science/article/pii/S016792361400284X,Volume 70,Feb-15
Explaining consumer satisfaction of services: The role of innovativeness and emotion in an electronic mediated environment,https://www.sciencedirect.com/science/article/pii/S0167923614002814,Volume 70,Feb-15
Editorial Board,https://www.sciencedirect.com/science/article/pii/S0167923614002863,Volume 69,Jan-15
A recommendation system for predicting risks across multiple business process instances,https://www.sciencedirect.com/science/article/pii/S0167923614002516,Volume 69,Jan-15
A collaborative filtering approach for recommending OLAP sessions,https://www.sciencedirect.com/science/article/pii/S016792361400270X,Volume 69,Jan-15
Effect of ticket-switching on inventory and shelf-space allocation,https://www.sciencedirect.com/science/article/pii/S0167923614002711,Volume 69,Jan-15
A theory of social media dependence: Evidence from microblog users,https://www.sciencedirect.com/science/article/pii/S0167923614002693,Volume 69,Jan-15
A bi-level decision support system for uncertain network design with equilibrium flow,https://www.sciencedirect.com/science/article/pii/S0167923614002826,Volume 69,Jan-15
Virtual friend recommendations in virtual worlds,https://www.sciencedirect.com/science/article/pii/S0167923614002723,Volume 69,Jan-15
Differential effects of social influence sources on self-reported music piracy,https://www.sciencedirect.com/science/article/pii/S0167923614002747,Volume 69,Jan-15
A Decision Support System for market-driven product positioning and design,https://www.sciencedirect.com/science/article/pii/S0167923614002772,Volume 69,Jan-15
"Alike people, alike interests? Inferring interest similarity in online social networks",https://www.sciencedirect.com/science/article/pii/S0167923614002759,Volume 69,Jan-15
Editorial Board,https://www.sciencedirect.com/science/article/pii/S0167923614002620,Volume 68,Dec-14
The influences of knowledge exchange on organizational c-commerce success and crisis readiness: The case of the crisis of an automobile manufacturing and merchandising group,https://www.sciencedirect.com/science/article/pii/S0167923614002462,Volume 68,Dec-14
DSS of vehicle refueling: A new enhanced approach with fuel weight considerations,https://www.sciencedirect.com/science/article/pii/S0167923614002504,Volume 68,Dec-14
Sentiment analysis: Bayesian Ensemble Learning,https://www.sciencedirect.com/science/article/pii/S0167923614002498,Volume 68,Dec-14
Decision support capabilities of enterprise content management systems: An empirical investigation,https://www.sciencedirect.com/science/article/pii/S0167923614002309,Volume 68,Dec-14
Decision support in hierarchical planning systems: The case of procurement planning in oil refining industries,https://www.sciencedirect.com/science/article/pii/S0167923614002310,Volume 68,Dec-14
Ontology based integration of XBRL filings for financial decision making,https://www.sciencedirect.com/science/article/pii/S0167923614002322,Volume 68,Dec-14
Recommender systems based on quantitative implicit customer feedback,https://www.sciencedirect.com/science/article/pii/S0167923614002334,Volume 68,Dec-14
A social network matrix for implicit and explicit social network plates,https://www.sciencedirect.com/science/article/pii/S0167923614002450,Volume 68,Dec-14
An ANP-multi-criteria-based methodology to link intangible assets and organizational performance in a Balanced Scorecard context,https://www.sciencedirect.com/science/article/pii/S0167923614002474,Volume 68,Dec-14
An empirical investigation of user and system recommendations in e-commerce,https://www.sciencedirect.com/science/article/pii/S0167923614002486,Volume 68,Dec-14
Editorial Board,https://www.sciencedirect.com/science/article/pii/S016792361400253X,Volume 67,Nov-14
Why Amazon uses both the New York Times Best Seller List and customer reviews: An empirical study of multiplier effects on product sales from multiple earned media,https://www.sciencedirect.com/science/article/pii/S0167923614002012,Volume 67,Nov-14
A decision support system for determining the optimal size of a new expressway service area: Focused on the profitability,https://www.sciencedirect.com/science/article/pii/S0167923614002024,Volume 67,Nov-14
Finding disseminators via electronic word of mouth message for effective marketing communications,https://www.sciencedirect.com/science/article/pii/S0167923614002036,Volume 67,Nov-14
Analyzing firm-specific social media and market: A stakeholder-based event analysis framework,https://www.sciencedirect.com/science/article/pii/S016792361400205X,Volume 67,Nov-14
An approach to finding the cost-effective immunization targets for information assurance,https://www.sciencedirect.com/science/article/pii/S0167923614002061,Volume 67,Nov-14
"Knowledge withholding intentions in teams: The roles of normative conformity, affective bonding, rational choice and social cognition",https://www.sciencedirect.com/science/article/pii/S0167923614002073,Volume 67,Nov-14
Continued usage intention of multifunctional friend networking services: A test of a dual-process model using Facebook,https://www.sciencedirect.com/science/article/pii/S0167923614002085,Volume 67,Nov-14
Examining the influence of online reviews on consumers' decision-making: A heuristic–systematic model,https://www.sciencedirect.com/science/article/pii/S0167923614002097,Volume 67,Nov-14
A relative patterns discovery for enhancing outlier detection in categorical data,https://www.sciencedirect.com/science/article/pii/S0167923614002218,Volume 67,Nov-14
Performance implications of stage-wise lead user participation in software development problem solving,https://www.sciencedirect.com/science/article/pii/S016792361400222X,Volume 67,Nov-14
Visual analysis of supply network risks: Insights from the electronics industry,https://www.sciencedirect.com/science/article/pii/S0167923614002255,Volume 67,Nov-14
"Isolation, insertion, and reconstruction: Three strategies to intervene in rumor spread based on supernetwork model",https://www.sciencedirect.com/science/article/pii/S0167923614002267,Volume 67,Nov-14
Editorial Board,https://www.sciencedirect.com/science/article/pii/S0167923614002358,Volume 66,Oct-14
Union values for games with coalition structure,https://www.sciencedirect.com/science/article/pii/S0167923614001407,Volume 66,Oct-14
"Analysis of process model reuse: Where are we now, where should we go from here?",https://www.sciencedirect.com/science/article/pii/S0167923614001729,Volume 66,Oct-14
Mobile health: Four emerging themes of research,https://www.sciencedirect.com/science/article/pii/S0167923614001754,Volume 66,Oct-14
Decision-making in IT service management: a simulation based approach,https://www.sciencedirect.com/science/article/pii/S0167923614001766,Volume 66,Oct-14
Scad-elastic net and the estimation of individual tourism expenditure determinants,https://www.sciencedirect.com/science/article/pii/S0167923614001778,Volume 66,Oct-14
A practical multi-sensor activity recognition system for home-based care,https://www.sciencedirect.com/science/article/pii/S0167923614001791,Volume 66,Oct-14
Generating information for small data sets with a multi-modal distribution,https://www.sciencedirect.com/science/article/pii/S016792361400178X,Volume 66,Oct-14
