Title,URL,Volume Issue,Vol Issue Year
Do smarter systems make for smarter organizations?,https://www.sciencedirect.com/science/article/pii/S0167923699000445,"Volume 27, Issues 1–2",Nov-99
Supporting Collaborative Process Knowledge Management in New Product Development Teams,https://www.sciencedirect.com/science/article/pii/S0167923699000457,"Volume 27, Issues 1–2",Nov-99
A decision support system for electric utilities: compliance with Clean Air Act,https://www.sciencedirect.com/science/article/pii/S0167923699000561,"Volume 26, Issue 4",Oct-99
Impact of information quality and decision-maker quality on decision quality: a theoretical model and simulation analysis,https://www.sciencedirect.com/science/article/pii/S0167923699000603,"Volume 26, Issue 4",Oct-99
Computer-mediated communication: problems and potentials of argumentation support systems,https://www.sciencedirect.com/science/article/pii/S0167923699000585,"Volume 26, Issue 4",Oct-99
HypEs: an architecture for hypermedia-enabled expert systems,https://www.sciencedirect.com/science/article/pii/S0167923699000573,"Volume 26, Issue 4",Oct-99
Index,https://www.sciencedirect.com/science/article/pii/S0167923699000640,"Volume 26, Issue 4",Oct-99
Index,https://www.sciencedirect.com/science/article/pii/S0167923699000652,"Volume 26, Issue 4",Oct-99
A decision support systems generator for transportation demand forecasting implemented by constraint logic programming,https://www.sciencedirect.com/science/article/pii/S0167923699000305,"Volume 26, Issue 3",Sep-99
Remote learning technologies: effectiveness of hypertext and GSS,https://www.sciencedirect.com/science/article/pii/S0167923699000287,"Volume 26, Issue 3",Sep-99
VisOpt: a visual interactive optimization tool for P-median problems,https://www.sciencedirect.com/science/article/pii/S0167923699000329,"Volume 26, Issue 3",Sep-99
Supporting decision making in combinatorially explosive multicriteria situations,https://www.sciencedirect.com/science/article/pii/S0167923699000299,"Volume 26, Issue 3",Sep-99
Incorporating critique and argumentation in DSS,https://www.sciencedirect.com/science/article/pii/S0167923699000317,"Volume 26, Issue 3",Sep-99
Editorial,https://www.sciencedirect.com/science/article/pii/S0167923699000226,"Volume 26, Issue 2",Aug-99
FARSYS: a knowledge-based system for managing strategic change,https://www.sciencedirect.com/science/article/pii/S0167923699000238,"Volume 26, Issue 2",Aug-99
A knowledge-based SWOT-analysis system as an instrument for strategic planning in small and medium sized enterprises,https://www.sciencedirect.com/science/article/pii/S016792369900024X,"Volume 26, Issue 2",Aug-99
Information systems and strategy design: The knowledge creation function in three modes of strategy-making,https://www.sciencedirect.com/science/article/pii/S0167923699000251,"Volume 26, Issue 2",Aug-99
SIMAR: a software environment to define and test strategic management knowledge bases,https://www.sciencedirect.com/science/article/pii/S0167923699000263,"Volume 26, Issue 2",Aug-99
Adapting on-line analytical processing for decision modelling: the interaction of information and decision technologies,https://www.sciencedirect.com/science/article/pii/S0167923699000214,"Volume 26, Issue 1",Jul-99
Designing personalized intelligent financial decision support systems,https://www.sciencedirect.com/science/article/pii/S0167923699000275,"Volume 26, Issue 1",Jul-99
Multiple-issue auction and market algorithms for the world wide web,https://www.sciencedirect.com/science/article/pii/S0167923699000160,"Volume 26, Issue 1",Jul-99
The SEC-system reuse: support for scheduling system development,https://www.sciencedirect.com/science/article/pii/S0167923699000184,"Volume 26, Issue 1",Jul-99
Circuit diagnosis support system for electronics assembly operations,https://www.sciencedirect.com/science/article/pii/S0167923699000159,"Volume 25, Issue 4",May-99
Representational congruence and information retrieval: Towards an extended model of cognitive fit,https://www.sciencedirect.com/science/article/pii/S0167923699000147,"Volume 25, Issue 4",May-99
A probabilistic model for interactive decision-making,https://www.sciencedirect.com/science/article/pii/S0167923699000135,"Volume 25, Issue 4",May-99
A user-access model-driven approach to proxy cache performance analysis,https://www.sciencedirect.com/science/article/pii/S0167923699000172,"Volume 25, Issue 4",May-99
Index,https://www.sciencedirect.com/science/article/pii/S0167923699000196,"Volume 25, Issue 4",May-99
Index,https://www.sciencedirect.com/science/article/pii/S0167923699000202,"Volume 25, Issue 4",May-99
Editorial,https://www.sciencedirect.com/science/article/pii/S0167923699000044,"Volume 25, Issue 3",Apr-99
A design of a DSS intermediary for electronic markets,https://www.sciencedirect.com/science/article/pii/S0167923699000056,"Volume 25, Issue 3",Apr-99
Metagraphs in workflow support systems,https://www.sciencedirect.com/science/article/pii/S0167923699000068,"Volume 25, Issue 3",Apr-99
Building online crisis management support using workflow systems,https://www.sciencedirect.com/science/article/pii/S016792369900007X,"Volume 25, Issue 3",Apr-99
An agent-based framework for building decision support systems,https://www.sciencedirect.com/science/article/pii/S0167923699000081,"Volume 25, Issue 3",Apr-99
A meta decision support system approach to coordinating production/marketing decisions,https://www.sciencedirect.com/science/article/pii/S0167923699000093,"Volume 25, Issue 3",Apr-99
"A methodology for specific, total enterprise, role-playing, intelligent gaming-simulation environment development",https://www.sciencedirect.com/science/article/pii/S0167923699000020,"Volume 25, Issue 2",Mar-99
Towards a model and algorithm management system for vehicle routing and scheduling problems,https://www.sciencedirect.com/science/article/pii/S0167923698000906,"Volume 25, Issue 2",Mar-99
"WWW-based negotiation support: design, implementation, and use",https://www.sciencedirect.com/science/article/pii/S0167923699000123,"Volume 25, Issue 2",Mar-99
Supporting business process redesign using cognitive maps,https://www.sciencedirect.com/science/article/pii/S0167923699000032,"Volume 25, Issue 2",Mar-99
A semiotics framework for information systems classification and development,https://www.sciencedirect.com/science/article/pii/S0167923698000888,"Volume 25, Issue 1",Feb-99
Pricing and capacity decisions of clustered twin-computer systems subject to breakdowns,https://www.sciencedirect.com/science/article/pii/S016792369800089X,"Volume 25, Issue 1",Feb-99
A new aggregation method in a fuzzy environment,https://www.sciencedirect.com/science/article/pii/S0167923698000876,"Volume 25, Issue 1",Feb-99
An agile approach to logical network analysis in decision support systems,https://www.sciencedirect.com/science/article/pii/S0167923698000918,"Volume 25, Issue 1",Feb-99
The balanced scorecard: a foundation for the strategic management of information systems,https://www.sciencedirect.com/science/article/pii/S0167923698000864,"Volume 25, Issue 1",Feb-99
Editorial,https://www.sciencedirect.com/science/article/pii/S0167923698000803,"Volume 24, Issues 3–4",Jan-99
"Operational risks, bidding strategies and information policies in restructured power markets",https://www.sciencedirect.com/science/article/pii/S0167923698000815,"Volume 24, Issues 3–4",Jan-99
Auctions for ancillary services,https://www.sciencedirect.com/science/article/pii/S0167923698000827,"Volume 24, Issues 3–4",Jan-99
A web-based platform for experimental investigation of electric power auctions,https://www.sciencedirect.com/science/article/pii/S0167923698000839,"Volume 24, Issues 3–4",Jan-99
Generation strategies for gaming transmission constraints: will the deregulated electric power market be an oligopoly?,https://www.sciencedirect.com/science/article/pii/S016792369800075X,"Volume 24, Issues 3–4",Jan-99
Multiple indices for optimal reactive power pricing and control,https://www.sciencedirect.com/science/article/pii/S0167923698000761,"Volume 24, Issues 3–4",Jan-99
The stability of electric energy markets,https://www.sciencedirect.com/science/article/pii/S0167923698000773,"Volume 24, Issues 3–4",Jan-99
Load-frequency control service in a deregulated environment,https://www.sciencedirect.com/science/article/pii/S0167923698000785,"Volume 24, Issues 3–4",Jan-99
Strategic behavior in electric generation markets via dynamic governor control design,https://www.sciencedirect.com/science/article/pii/S0167923698000797,"Volume 24, Issues 3–4",Jan-99
A stochastic study of hidden failures in power system protection,https://www.sciencedirect.com/science/article/pii/S0167923698000694,"Volume 24, Issues 3–4",Jan-99
Collaboration rules for autonomous software agents,https://www.sciencedirect.com/science/article/pii/S0167923698000700,"Volume 24, Issues 3–4",Jan-99
Modeling the consumer benefit in the optimal power flow,https://www.sciencedirect.com/science/article/pii/S0167923698000712,"Volume 24, Issues 3–4",Jan-99
A transmission-constrained unit commitment method in power system scheduling,https://www.sciencedirect.com/science/article/pii/S0167923698000724,"Volume 24, Issues 3–4",Jan-99
Scheduling of thermal units with a nonlinear load flow network model,https://www.sciencedirect.com/science/article/pii/S0167923698000736,"Volume 24, Issues 3–4",Jan-99
Error analysis in electric power system available transfer capability computation,https://www.sciencedirect.com/science/article/pii/S0167923698000748,"Volume 24, Issues 3–4",Jan-99
Index,https://www.sciencedirect.com/science/article/pii/S016792369900010X,"Volume 24, Issues 3–4",Jan-99
Index,https://www.sciencedirect.com/science/article/pii/S0167923699000111,"Volume 24, Issues 3–4",Jan-99
The development of an adaptive decision support system,https://www.sciencedirect.com/science/article/pii/S0167923698000657,"Volume 24, Issue 2",Dec-98
Managerial intuition and the development of executive support systems,https://www.sciencedirect.com/science/article/pii/S0167923698000566,"Volume 24, Issue 2",Dec-98
A decision support system for sales forecasting through fuzzy neural networks with asymmetric fuzzy weights,https://www.sciencedirect.com/science/article/pii/S0167923698000670,"Volume 24, Issue 2",Dec-98
Model and data integration and re-use in environmental decision support systems,https://www.sciencedirect.com/science/article/pii/S0167923698000682,"Volume 24, Issue 2",Dec-98
Incorporating cognitive aids into decision support systems: the case of the strategy execution process,https://www.sciencedirect.com/science/article/pii/S0167923698000669,"Volume 24, Issue 2",Dec-98
Flexible planning and dynamic integration for problem solving in SXSES-DSS,https://www.sciencedirect.com/science/article/pii/S0167923698000554,"Volume 24, Issue 2",Dec-98
Editorial,https://www.sciencedirect.com/science/article/pii/S016792369800058X,"Volume 24, Issue 1",Nov-98
"An economic analysis of electronic secondary markets: installed base, technology, durability and firm profitability",https://www.sciencedirect.com/science/article/pii/S0167923698000591,"Volume 24, Issue 1",Nov-98
Flexible double auctions for electronic commerce: theory and implementation,https://www.sciencedirect.com/science/article/pii/S0167923698000608,"Volume 24, Issue 1",Nov-98
An empirical study on consumer acceptance of products in electronic markets: a transaction cost model,https://www.sciencedirect.com/science/article/pii/S016792369800061X,"Volume 24, Issue 1",Nov-98
An empirical analysis of customer satisfaction for Intranet marketing systems,https://www.sciencedirect.com/science/article/pii/S0167923698000621,"Volume 24, Issue 1",Nov-98
Managing computing resources in intranets: an electronic commerce perspective,https://www.sciencedirect.com/science/article/pii/S0167923698000633,"Volume 24, Issue 1",Nov-98
Anonymous mechanisms in group decision support systems communication,https://www.sciencedirect.com/science/article/pii/S0167923698000578,"Volume 23, Issue 4",Oct-98
Intelligent solution and analysis of goal programmes: the GPSYS system,https://www.sciencedirect.com/science/article/pii/S0167923698000529,"Volume 23, Issue 4",Oct-98
Interactive group decision process with evolutionary database,https://www.sciencedirect.com/science/article/pii/S0167923698000542,"Volume 23, Issue 4",Oct-98
Evaluation of intranets in a distributed environment,https://www.sciencedirect.com/science/article/pii/S0167923698000645,"Volume 23, Issue 4",Oct-98
Editorial,https://www.sciencedirect.com/science/article/pii/S0167923698000499,"Volume 23, Issue 4",Oct-98
Contributors to quality during software maintenance,https://www.sciencedirect.com/science/article/pii/S0167923698000517,"Volume 23, Issue 4",Oct-98
An image construction method for visualizing managerial data,https://www.sciencedirect.com/science/article/pii/S0167923698000505,"Volume 23, Issue 4",Oct-98
Index,https://www.sciencedirect.com/science/article/pii/S0167923698000840,"Volume 23, Issue 4",Oct-98
Index,https://www.sciencedirect.com/science/article/pii/S0167923698000852,"Volume 23, Issue 4",Oct-98
A study of the effect of communication channel and authority on group decision processes and outcomes,https://www.sciencedirect.com/science/article/pii/S0167923698000487,"Volume 23, Issue 3",Jul-98
Towards a practical method to validate decision support systems,https://www.sciencedirect.com/science/article/pii/S0167923698000463,"Volume 23, Issue 3",Jul-98
A decision support system for partial drug testing: DSS-DT,https://www.sciencedirect.com/science/article/pii/S0167923698000475,"Volume 23, Issue 3",Jul-98
A marketing category management system: a decision support system using scanner data,https://www.sciencedirect.com/science/article/pii/S0167923698000530,"Volume 23, Issue 3",Jul-98
Decision support for siting problems,https://www.sciencedirect.com/science/article/pii/S0167923698000426,"Volume 23, Issue 3",Jul-98
"An interactive graphics-based linear, integer and goal programme modelling environment",https://www.sciencedirect.com/science/article/pii/S0167923698000451,"Volume 23, Issue 3",Jul-98
Support for mobile communications planning,https://www.sciencedirect.com/science/article/pii/S0167923698000384,"Volume 23, Issue 2",Jun-98
A hypertext environment for linear optimisation,https://www.sciencedirect.com/science/article/pii/S0167923698000396,"Volume 23, Issue 2",Jun-98
"Active involvement, familiarity, framing, and the illusion of control during decision support system use",https://www.sciencedirect.com/science/article/pii/S0167923698000438,"Volume 23, Issue 2",Jun-98
"A review of research in Group Support Systems: leaders, approaches and directions",https://www.sciencedirect.com/science/article/pii/S0167923698000414,"Volume 23, Issue 2",Jun-98
Forecasting S&P 500 stock index futures with a hybrid AI system,https://www.sciencedirect.com/science/article/pii/S0167923698000281,"Volume 23, Issue 2",Jun-98
A proposed research framework for distributed group support systems,https://www.sciencedirect.com/science/article/pii/S0167923698000402,"Volume 23, Issue 2",Jun-98
A reduction method for theorem proving based on the partial-instantiation technique,https://www.sciencedirect.com/science/article/pii/S016792369800044X,"Volume 23, Issue 2",Jun-98
Editorial,https://www.sciencedirect.com/science/article/pii/S0167923698000311,"Volume 23, Issue 1",May-98
Organizational knowledge and the Intranet,https://www.sciencedirect.com/science/article/pii/S0167923698000323,"Volume 23, Issue 1",May-98
Decision support using the Intranet,https://www.sciencedirect.com/science/article/pii/S0167923698000335,"Volume 23, Issue 1",May-98
Migrating to the Web: a Web financial information system server,https://www.sciencedirect.com/science/article/pii/S0167923698000347,"Volume 23, Issue 1",May-98
An intelligent personal spider (agent) for dynamic Internet/Intranet searching,https://www.sciencedirect.com/science/article/pii/S0167923698000359,"Volume 23, Issue 1",May-98
Hierarchical Structure of Intranet Functions and Their Relative Importance:: Using the Analytic Hierarchy Process for Virtual Organizations,https://www.sciencedirect.com/science/article/pii/S0167923698000360,"Volume 23, Issue 1",May-98
Information infrastructure for electronic virtual organization management,https://www.sciencedirect.com/science/article/pii/S0167923698000372,"Volume 23, Issue 1",May-98
SYNOPSE: a model-based decision support system for the evaluation of flight schedules for cargo airlines,https://www.sciencedirect.com/science/article/pii/S016792369800027X,"Volume 22, Issue 4",Apr-98
Future trends in model management systems: parallel and distributed extensions,https://www.sciencedirect.com/science/article/pii/S0167923698000256,"Volume 22, Issue 4",Apr-98
Hitting the wall: errors in developing and code inspecting a `simple' spreadsheet model,https://www.sciencedirect.com/science/article/pii/S0167923697000389,"Volume 22, Issue 4",Apr-98
Model integration using SML,https://www.sciencedirect.com/science/article/pii/S0167923697000651,"Volume 22, Issue 4",Apr-98
Inheritance rules for flexible model retrieval,https://www.sciencedirect.com/science/article/pii/S0167923698000268,"Volume 22, Issue 4",Apr-98
Comment on “Logical representation of integer programming models”,https://www.sciencedirect.com/science/article/pii/S0167923697000572,"Volume 22, Issue 4",Apr-98
Answer to comment on logical representation of integer programming models,https://www.sciencedirect.com/science/article/pii/S0167923697000559,"Volume 22, Issue 4",Apr-98
"Speech acts, electronic commerce, and KQML",https://www.sciencedirect.com/science/article/pii/S0167923697000596,"Volume 22, Issue 3",Mar-98
Categorizing automated messages,https://www.sciencedirect.com/science/article/pii/S0167923697000602,"Volume 22, Issue 3",Mar-98
A logic-based modeling of resource consumption and production,https://www.sciencedirect.com/science/article/pii/S0167923697000614,"Volume 22, Issue 3",Mar-98
On hypermedia-based argumentation decision support systems,https://www.sciencedirect.com/science/article/pii/S0167923697000626,"Volume 22, Issue 3",Mar-98
Defeasible logic graphs: I. Theory,https://www.sciencedirect.com/science/article/pii/S0167923697000638,"Volume 22, Issue 3",Mar-98
Defeasible logic graphs: II. Implementation,https://www.sciencedirect.com/science/article/pii/S016792369700064X,"Volume 22, Issue 3",Mar-98
An implementation of a graph-based modeling system for structured modeling (GBMS/SM),https://www.sciencedirect.com/science/article/pii/S0167923697000560,"Volume 22, Issue 2",Feb-98
The impact of transborder data flow restrictions on international information systems management,https://www.sciencedirect.com/science/article/pii/S0167923697000493,"Volume 22, Issue 2",Feb-98
Judgmental adjustment in time series forecasting using neural networks,https://www.sciencedirect.com/science/article/pii/S016792369700050X,"Volume 22, Issue 2",Feb-98
Constraint logic programming framework for integrated decision supports,https://www.sciencedirect.com/science/article/pii/S0167923697000535,"Volume 22, Issue 2",Feb-98
Toward global optimization of neural networks: A comparison of the genetic algorithm and backpropagation,https://www.sciencedirect.com/science/article/pii/S0167923697000407,"Volume 22, Issue 2",Feb-98
Evaluation of ordering strategies for constraint satisfaction reactive scheduling,https://www.sciencedirect.com/science/article/pii/S0167923697000523,"Volume 22, Issue 2",Feb-98
A framework for the classification of DSS usage across organizations,https://www.sciencedirect.com/science/article/pii/S0167923697000390,"Volume 22, Issue 1",Jan-98
The antecedents and consequents of user perceptions in information technology adoption,https://www.sciencedirect.com/science/article/pii/S0167923697000067,"Volume 22, Issue 1",Jan-98
Key antecedents of Executive Information System success: a path analytic approach,https://www.sciencedirect.com/science/article/pii/S0167923697000328,"Volume 22, Issue 1",Jan-98
Decision support for managing organizational design dynamics,https://www.sciencedirect.com/science/article/pii/S0167923696000590,"Volume 22, Issue 1",Jan-98
A note on synthesizing group decisions,https://www.sciencedirect.com/science/article/pii/S0167923696000619,"Volume 22, Issue 1",Jan-98
Spatial decision support systems for vehicle routing,https://www.sciencedirect.com/science/article/pii/S0167923697000547,"Volume 22, Issue 1",Jan-98
Data influences the result more than preferences: Some lessons from implementation of multiattribute techniques in a real decision task,https://www.sciencedirect.com/science/article/pii/S0167923697000249,"Volume 22, Issue 1",Jan-98
A comprehensive method for the evaluation of complete intelligent tutoring systems,https://www.sciencedirect.com/science/article/pii/S016792369700033X,"Volume 22, Issue 1",Jan-98
Editorial,https://www.sciencedirect.com/science/article/pii/S0167923697000419,"Volume 21, Issue 4",Dec-97
Classifying and detecting anomalies in hybrid knowledge-based systems,https://www.sciencedirect.com/science/article/pii/S0167923697000432,"Volume 21, Issue 4",Dec-97
Verification of non-monotonic knowledge bases,https://www.sciencedirect.com/science/article/pii/S0167923697000444,"Volume 21, Issue 4",Dec-97
Inference engine greediness: subsumption and suboptimality,https://www.sciencedirect.com/science/article/pii/S0167923697000420,"Volume 21, Issue 4",Dec-97
Applying rule-base anomalies to KADS inference structures,https://www.sciencedirect.com/science/article/pii/S0167923697000456,"Volume 21, Issue 4",Dec-97
Using goals to design and verify rule bases,https://www.sciencedirect.com/science/article/pii/S0167923697000468,"Volume 21, Issue 4",Dec-97
A survey of tools for the validation and verification of knowledge-based systems: 1985–1995,https://www.sciencedirect.com/science/article/pii/S016792369700047X,"Volume 21, Issue 4",Dec-97
Introduction to the special issue,https://www.sciencedirect.com/science/article/pii/S0167923697000316,"Volume 21, Issue 3,
Pages 147-227 (November 1997)",Nov-97
Research opportunities in electronic commerce,https://www.sciencedirect.com/science/article/pii/S0167923697000250,"Volume 21, Issue 3,
Pages 147-227 (November 1997)",Nov-97
Internet-based EDI strategy,https://www.sciencedirect.com/science/article/pii/S0167923697000262,"Volume 21, Issue 3,
Pages 147-227 (November 1997)",Nov-97
Viewing the Web as a marketplace: the case of small companies,https://www.sciencedirect.com/science/article/pii/S0167923697000274,"Volume 21, Issue 3,
Pages 147-227 (November 1997)",Nov-97
Characteristics of electronic markets,https://www.sciencedirect.com/science/article/pii/S0167923697000286,"Volume 21, Issue 3,
Pages 147-227 (November 1997)",Nov-97
A response to dynamic change in the market place,https://www.sciencedirect.com/science/article/pii/S0167923697000298,"Volume 21, Issue 3,
Pages 147-227 (November 1997)",Nov-97
National information infrastructure in Pacific Asia,https://www.sciencedirect.com/science/article/pii/S0167923697000304,"Volume 21, Issue 3,
Pages 147-227 (November 1997)",Nov-97
Introduction: expertise and modeling expert decision making,https://www.sciencedirect.com/science/article/pii/S016792369700016X,"Volume 21, Issue 2,
Pages 49-146 (October 1997)",Oct-97
Management experience and management expertise,https://www.sciencedirect.com/science/article/pii/S0167923697000171,"Volume 21, Issue 2,
Pages 49-146 (October 1997)",Oct-97
FILM: a fuzzy inductive learning method for automated knowledge acquisition,https://www.sciencedirect.com/science/article/pii/S0167923697000195,"Volume 21, Issue 2,
Pages 49-146 (October 1997)",Oct-97
Aggregating multiple expert data for linear case valuation models using the MDE principle,https://www.sciencedirect.com/science/article/pii/S0167923697000183,"Volume 21, Issue 2,
Pages 49-146 (October 1997)",Oct-97
Inductive modeling of expert decision making in loan evaluation: a decision strategy perspective,https://www.sciencedirect.com/science/article/pii/S0167923697000225,"Volume 21, Issue 2,
Pages 49-146 (October 1997)",Oct-97
Strategic decision-making processes: network-based representation and stochastic simulation,https://www.sciencedirect.com/science/article/pii/S0167923697000237,"Volume 21, Issue 2,
Pages 49-146 (October 1997)",Oct-97
"Understanding expertise in information systems design, or, What's all the fuss about objects?",https://www.sciencedirect.com/science/article/pii/S0167923697000201,"Volume 21, Issue 2,
Pages 49-146 (October 1997)",Oct-97
Effectiveness of decision support systems: development or reliance effect?,https://www.sciencedirect.com/science/article/pii/S0167923697000213,"Volume 21, Issue 2,
Pages 49-146 (October 1997)",Oct-97
Editorial Board,https://www.sciencedirect.com/science/article/pii/S0167923697900051,"Volume 21, Issue 1",Sep-97
Editor's introduction to the special issue on knowledge discovery and its applications to business decision-making,https://www.sciencedirect.com/science/article/pii/S0167923697000080,"Volume 21, Issue 1",Sep-97
Bridging the gap between business objectives and parameters of data mining algorithms,https://www.sciencedirect.com/science/article/pii/S0167923697000109,"Volume 21, Issue 1",Sep-97
Decision support for real-time telemarketing operations through Bayesian network learning,https://www.sciencedirect.com/science/article/pii/S0167923697000092,"Volume 21, Issue 1",Sep-97
Discovering and using knowledge from unsupervised data,https://www.sciencedirect.com/science/article/pii/S0167923697000110,"Volume 21, Issue 1",Sep-97
Knowledge discovery by inspection,https://www.sciencedirect.com/science/article/pii/S0167923697000122,"Volume 21, Issue 1",Sep-97
An improved neural network for manufacturing cell formation,https://www.sciencedirect.com/science/article/pii/S0167923697000158,"Volume 20, Issue 4",Aug-97
