Title,Issue_Title,Issue_URL
"Volume 9 Issue 3, September 1994",Book Review: The virtual community,https://journals.sagepub.com/doi/abs/10.1177/026839629400900309
"Volume 9 Issue 3, September 1994",Book Review: Software inspection,https://journals.sagepub.com/doi/abs/10.1177/026839629400900310
"Volume 9 Issue 2, June 1994",Theme Issue – Organizational Perspectives on Collaborative Working,https://journals.sagepub.com/doi/abs/10.1177/026839629400900208
"Volume 9 Issue 2, June 1994","The State-Of-The-Art of Cscw: Cscw Systems, Cooperative Work and Organization",https://journals.sagepub.com/doi/abs/10.1177/026839629400900209
"Volume 9 Issue 2, June 1994",Computer Supported Collaborative Working: Lessons from Elsewhere,https://journals.sagepub.com/doi/abs/10.1177/026839629400900201
"Volume 9 Issue 2, June 1994",The Organization of Organizations: Issues for Next-Generation Office IT,https://journals.sagepub.com/doi/abs/10.1177/026839629400900202
"Volume 9 Issue 2, June 1994",Distributed Cognition: An Alternative Framework for Analysing and Explaining Collaborative Working,https://journals.sagepub.com/doi/abs/10.1177/026839629400900203
"Volume 9 Issue 2, June 1994",Post(-)Modern Organizations: Understanding how Cscw Affects Organizations,https://journals.sagepub.com/doi/abs/10.1177/026839629400900204
"Volume 9 Issue 2, June 1994",The Stages Model and the Phases of the IS Field,https://journals.sagepub.com/doi/abs/10.1177/026839629400900205
"Volume 9 Issue 2, June 1994",An Assessment of Information Systems Taxonomies: Time to be Re-Evaluate?,https://journals.sagepub.com/doi/abs/10.1177/026839629400900206
"Volume 9 Issue 2, June 1994",The Adoption of it in Management Accounting: The Expert Systems Experience,https://journals.sagepub.com/doi/abs/10.1177/026839629400900207
"Volume 9 Issue 1, March 1994",Editorial,https://journals.sagepub.com/doi/abs/10.1177/026839629400900101
"Volume 9 Issue 1, March 1994",A Product-Process Model of Innovation in Software Development,https://journals.sagepub.com/doi/abs/10.1177/026839629400900102
"Volume 9 Issue 1, March 1994",The Effectiveness of Decision Support Systems: The Implications of Task Complexity and Dss Sophistication,https://journals.sagepub.com/doi/abs/10.1177/026839629400900103
"Volume 9 Issue 1, March 1994",An Approach to Development of Decision Support Systems for a Public Sector Administration,https://journals.sagepub.com/doi/abs/10.1177/026839629400900104
"Volume 9 Issue 1, March 1994",Introducing it into a Mature Production Related Work Environment: The Human Resource Factor,https://journals.sagepub.com/doi/abs/10.1177/026839629400900105
"Volume 9 Issue 1, March 1994",A Study of User Participation in Information Systems Development,https://journals.sagepub.com/doi/abs/10.1177/026839629400900106
"Volume 9 Issue 1, March 1994",Strategic Choice and Data Envelopment Analysis: Comparing Computers across Many Attributes,https://journals.sagepub.com/doi/abs/10.1177/026839629400900107
"Volume 8 Issue 4, December 1993",Editorial,https://journals.sagepub.com/doi/abs/10.1177/026839629300800401
"Volume 8 Issue 4, December 1993",Information Systems Strategies and the Management of Organizational Change – a Strategic Alignment Model,https://journals.sagepub.com/doi/abs/10.1177/026839629300800402
"Volume 8 Issue 4, December 1993",Core Competence and Learning Alliances – the New Face of Information Management?,https://journals.sagepub.com/doi/abs/10.1177/026839629300800403
"Volume 8 Issue 4, December 1993",An Integrated Framework for Information Systems Planning and Its Initial Application,https://journals.sagepub.com/doi/abs/10.1177/026839629300800404
"Volume 8 Issue 4, December 1993",Teleworking: An Information Technology Tool for Integrated Broadband Communication Development in Rural Areas of Europe,https://journals.sagepub.com/doi/abs/10.1177/026839629300800405
"Volume 8 Issue 4, December 1993",User Satisfaction and Service Quality of the IS Department: Closing the Gaps,https://journals.sagepub.com/doi/abs/10.1177/026839629300800406
"Volume 8 Issue 4, December 1993",Information Systems Methodologies in Use,https://journals.sagepub.com/doi/abs/10.1177/026839629300800407
"Volume 8 Issue 4, December 1993",A Review of the Methodologies Movement,https://journals.sagepub.com/doi/abs/10.1177/026839629300800408
"Volume 8 Issue 4, December 1993",A Report on the Third Annual UK Information Systems Doctoral Consortium,https://journals.sagepub.com/doi/abs/10.1177/026839629300800409
"Volume 8 Issue 3, September 1993",Editorial,https://journals.sagepub.com/doi/abs/10.1177/026839629300800301
"Volume 8 Issue 3, September 1993",Planning for Information Systems Resources?,https://journals.sagepub.com/doi/abs/10.1177/026839629300800302
"Volume 8 Issue 3, September 1993",Coordination of Joint Tasks in Organizational Processes,https://journals.sagepub.com/doi/abs/10.1177/026839629300800303
"Volume 8 Issue 3, September 1993",Stages of Growth in End-User Computing: Applications in the Health Sector of Developing Countries in Asia-Pacific,https://journals.sagepub.com/doi/abs/10.1177/026839629300800304
"Volume 8 Issue 3, September 1993",Computer Language: Impact on Information Systems Development,https://journals.sagepub.com/doi/abs/10.1177/026839629300800305
"Volume 8 Issue 3, September 1993",Toward An Empirical Taxonomy and Model of Evolution for Telecommunications Technologies,https://journals.sagepub.com/doi/abs/10.1177/026839629300800306
"Volume 8 Issue 3, September 1993",Moving from An Executive Information System to Everyone's Information System: Lessons from a Case Study,https://journals.sagepub.com/doi/abs/10.1177/026839629300800307
"Volume 8 Issue 3, September 1993",Financial Analysis and Expert Systems,https://journals.sagepub.com/doi/abs/10.1177/026839629300800308
"Volume 8 Issue 3, September 1993",Book Review: Information Strategies in Public Administration,https://journals.sagepub.com/doi/abs/10.1177/026839629300800309
"Volume 8 Issue 3, September 1993",Book Review: Japan's software factories: A challenge to US management,https://journals.sagepub.com/doi/abs/10.1177/026839629300800310
"Volume 8 Issue 3, September 1993",Book Review: Computerization and Controversy: Value Conflicts and Social Choices,https://journals.sagepub.com/doi/abs/10.1177/026839629300800311
"Volume 8 Issue 3, September 1993",Book Review: Object-oriented analysis,https://journals.sagepub.com/doi/abs/10.1177/026839629300800312
"Volume 8 Issue 3, September 1993",Book Review: Business Process Re-engineering: The Use of Process Redesign and IT to Transform Corporate Performance,https://journals.sagepub.com/doi/abs/10.1177/026839629300800313
"Volume 8 Issue 2, June 1993",Editorial,https://journals.sagepub.com/doi/abs/10.1177/026839629300800209
"Volume 8 Issue 2, June 1993",Promise and Problems: Case Usage in the US,https://journals.sagepub.com/doi/abs/10.1177/026839629300800201
"Volume 8 Issue 2, June 1993",Decentralization of is in Developing Countries: Power to the People?,https://journals.sagepub.com/doi/abs/10.1177/026839629300800202
"Volume 8 Issue 2, June 1993",Software Standards: An Information Requirements Framework,https://journals.sagepub.com/doi/abs/10.1177/026839629300800203
"Volume 8 Issue 2, June 1993",Research Issues in Information Systems,https://journals.sagepub.com/doi/abs/10.1177/026839629300800204
"Volume 8 Issue 2, June 1993",A Contingency Perspective on Effective Prototyping,https://journals.sagepub.com/doi/abs/10.1177/026839629300800205
"Volume 8 Issue 2, June 1993",Making Database Marketing Work,https://journals.sagepub.com/doi/abs/10.1177/026839629300800206
"Volume 8 Issue 2, June 1993","Doctoral Information Systems Research in Britain: A Report on the Uk Information Systems Doctoral Consortiums, 1991–1993",https://journals.sagepub.com/doi/abs/10.1177/026839629300800207
"Volume 8 Issue 2, June 1993","Association of Computing Machinery Special Interest Group in Computer Personnel Research. Annual Conference, April 1992, Cincinnati OH, USA",https://journals.sagepub.com/doi/abs/10.1177/026839629300800208
"Volume 8 Issue 1, March 1993",Editorial,https://journals.sagepub.com/doi/abs/10.1177/026839629300800101
"Volume 8 Issue 1, March 1993",Information Technology Transfer in Econometric Forecasting: A Pictorial Approach,https://journals.sagepub.com/doi/abs/10.1177/026839629300800102
"Volume 8 Issue 1, March 1993",The Economic Significance of Infrastructural IT Systems,https://journals.sagepub.com/doi/abs/10.1177/026839629300800103
"Volume 8 Issue 1, March 1993",Information Systems Software Cost Estimating: A Current Assessment,https://journals.sagepub.com/doi/abs/10.1177/026839629300800104
"Volume 8 Issue 1, March 1993",ITs and Structural Change: The Case of Local Area Network Implementation,https://journals.sagepub.com/doi/abs/10.1177/026839629300800105
"Volume 8 Issue 1, March 1993",Management Challenges for Survival in the 1990S,https://journals.sagepub.com/doi/abs/10.1177/026839629300800106
"Volume 8 Issue 1, March 1993",Reaping the Benefits of a Responsive IT Department,https://journals.sagepub.com/doi/abs/10.1177/026839629300800107
"Volume 8 Issue 1, March 1993",New Management Patterns: Key Findings from the Mit90S Research Study,https://journals.sagepub.com/doi/abs/10.1177/026839629300800108
"Volume 7 Issue 4, December 1992",Theme Issue: Information Technology and Marketing,https://journals.sagepub.com/doi/abs/10.1177/026839629200700401
"Volume 7 Issue 4, December 1992",Information Technology as a Service Operation,https://journals.sagepub.com/doi/abs/10.1177/026839629200700402
"Volume 7 Issue 4, December 1992",Customer Service and Information Technology,https://journals.sagepub.com/doi/abs/10.1177/026839629200700403
"Volume 7 Issue 4, December 1992",Internationalization of the Firm and Impacts of Videotex Networks,https://journals.sagepub.com/doi/abs/10.1177/026839629200700404
"Volume 7 Issue 4, December 1992",Computerized Marketing Databases: Their Role Now and in the Future,https://journals.sagepub.com/doi/abs/10.1177/026839629200700405
"Volume 7 Issue 4, December 1992",Users’ Knowledge as a Specific Asset: The Case of the Valued Added Services,https://journals.sagepub.com/doi/abs/10.1177/026839629200700406
"Volume 7 Issue 4, December 1992",Expert Systems in International Marketing,https://journals.sagepub.com/doi/abs/10.1177/026839629200700407
"Volume 7 Issue 4, December 1992",A Vision of the Future? An Innovative Database Micromarketing System,https://journals.sagepub.com/doi/abs/10.1177/026839629200700408
"Volume 7 Issue 4, December 1992",Managing the Local Market: Information Technology Applications in Retailing,https://journals.sagepub.com/doi/abs/10.1177/026839629200700409
"Volume 7 Issue 3, September 1992",Editorial,https://journals.sagepub.com/doi/abs/10.1177/026839629200700301
"Volume 7 Issue 3, September 1992",Applying Methodologies for Information Systems Development,https://journals.sagepub.com/doi/abs/10.1177/026839629200700302
"Volume 7 Issue 3, September 1992",Methodological Requirements for Information Systems Development,https://journals.sagepub.com/doi/abs/10.1177/026839629200700303
"Volume 7 Issue 3, September 1992",The Diffusion of Digital Technologies in Magazine Print Publishing: Organizational Change and Strategic Choices,https://journals.sagepub.com/doi/abs/10.1177/026839629200700304
"Volume 7 Issue 3, September 1992",MIS Success: Why Does it Vary among Users?,https://journals.sagepub.com/doi/abs/10.1177/026839629200700305
"Volume 7 Issue 3, September 1992",Information Economics: A Practical Approach to Valuing Information Systems,https://journals.sagepub.com/doi/abs/10.1177/026839629200700306
"Volume 7 Issue 3, September 1992",Use of Executive Information Systems in Measuring Business Performance,https://journals.sagepub.com/doi/abs/10.1177/026839629200700307
"Volume 7 Issue 2, June 1992",Editorial,https://journals.sagepub.com/doi/abs/10.1177/026839629200700201
"Volume 7 Issue 2, June 1992",The Automation of Accounting Practice,https://journals.sagepub.com/doi/abs/10.1177/026839629200700202
"Volume 7 Issue 2, June 1992",Researching Information Systems: Data Analysis Methodology Using Content and Correspondence Analysis,https://journals.sagepub.com/doi/abs/10.1177/026839629200700203
"Volume 7 Issue 2, June 1992",Issues in the Design and Administration of Distributed Model Management Systems,https://journals.sagepub.com/doi/abs/10.1177/026839629200700204
"Volume 7 Issue 2, June 1992",Re-Engineering Tools Have the Potential to Overcome Systems Maintenance Bottleneck,https://journals.sagepub.com/doi/abs/10.1177/026839629200700205
"Volume 7 Issue 2, June 1992",Putting it in its Place: A Polemic for the Nineties,https://journals.sagepub.com/doi/abs/10.1177/026839629200700206
"Volume 7 Issue 2, June 1992",Evaluating Investments in IT,https://journals.sagepub.com/doi/abs/10.1177/026839629200700207
"Volume 7 Issue 2, June 1992",Book Review: Package evaluation,https://journals.sagepub.com/doi/abs/10.1177/026839629200700208
"Volume 7 Issue 1, March 1992",Editorial,https://journals.sagepub.com/doi/abs/10.1177/026839629200700101
"Volume 7 Issue 1, March 1992",Competition in the Telecommunications Industry: A New Global Paradigm and its Limits,https://journals.sagepub.com/doi/abs/10.1177/026839629200700102
"Volume 7 Issue 1, March 1992",Scenario Playing for Critical Success Factor Analysis,https://journals.sagepub.com/doi/abs/10.1177/026839629200700103
"Volume 7 Issue 1, March 1992",Computer-based Information Systems for Decentralized Rural Development Administration: A Case Study in India,https://journals.sagepub.com/doi/abs/10.1177/026839629200700104
"Volume 7 Issue 1, March 1992",Towards a Taxonomy of Information Systems: Or Does Anyone Need a Taxi?,https://journals.sagepub.com/doi/abs/10.1177/026839629200700105
"Volume 7 Issue 1, March 1992",Towards Determining the Appropriate Systems Development Environment: The Role of Task Characteristics,https://journals.sagepub.com/doi/abs/10.1177/026839629200700106
"Volume 7 Issue 1, March 1992",Risk Analysis for Information Systems,https://journals.sagepub.com/doi/abs/10.1177/026839629200700107
"Volume 7 Issue 1, March 1992",Computers in the City – November 1991,https://journals.sagepub.com/doi/abs/10.1177/026839629200700108
"Volume 7 Issue 1, March 1992",Making IT Strategy Succeed: Creating a Strategic Alliance between IT and the Business,https://journals.sagepub.com/doi/abs/10.1177/026839629200700109
"Volume 6 Issue 3-4, September 1991",Editorial,https://journals.sagepub.com/doi/abs/10.1177/0268396291006003-401
"Volume 6 Issue 3-4, September 1991",AIT Annual Report 1991,https://journals.sagepub.com/doi/abs/10.1177/0268396291006003-402
"Volume 6 Issue 3-4, September 1991",Introduction: Human Resource and Organizational Issues in the 1990s,https://journals.sagepub.com/doi/abs/10.1177/0268396291006003-403
"Volume 6 Issue 3-4, September 1991",The Chief Executive Officer and the Chief Information Officer: The Strategic Partnership,https://journals.sagepub.com/doi/abs/10.1177/0268396291006003-404
"Volume 6 Issue 3-4, September 1991",A Human Resource Approach to Information Systems Development – the ISU (Information Systems Use) Design Model,https://journals.sagepub.com/doi/abs/10.1177/0268396291006003-405
"Volume 6 Issue 3-4, September 1991",A User-Satisfaction Approach to IS Effectiveness Measurement,https://journals.sagepub.com/doi/abs/10.1177/0268396291006003-406
"Volume 6 Issue 3-4, September 1991",An Application of Group Decision Support Technology in Collective Bargaining,https://journals.sagepub.com/doi/abs/10.1177/0268396291006003-407
"Volume 6 Issue 3-4, September 1991",The Evolution of Interorganizational Systems,https://journals.sagepub.com/doi/abs/10.1177/0268396291006003-408
"Volume 6 Issue 3-4, September 1991",IT Directors and it Strategy,https://journals.sagepub.com/doi/abs/10.1177/0268396291006003-409
"Volume 6 Issue 3-4, September 1991",Catalyst: A Programme for Change within British Airways,https://journals.sagepub.com/doi/abs/10.1177/0268396291006003-410
"Volume 6 Issue 3-4, September 1991",A Critical Look at Expert Systems for Business Information Applications,https://journals.sagepub.com/doi/abs/10.1177/0268396291006003-411
"Volume 6 Issue 3-4, September 1991",Strategies for Teaching Information Systems,https://journals.sagepub.com/doi/abs/10.1177/0268396291006003-412
"Volume 6 Issue 3-4, September 1991",Using an Information Systems Strategic Model to Give a Strategy for Teaching Information Systems,https://journals.sagepub.com/doi/abs/10.1177/0268396291006003-413
"Volume 6 Issue 3-4, September 1991",Creating a Strategic Business-Based IT Policy,https://journals.sagepub.com/doi/abs/10.1177/0268396291006003-414
"Volume 6 Issue 3-4, September 1991",Computer Representation of Management Policy,https://journals.sagepub.com/doi/abs/10.1177/0268396291006003-415
"Volume 6 Issue 3-4, September 1991",Book Review: Heritage Sites: Strategies for Marketing and Development,https://journals.sagepub.com/doi/abs/10.1177/0268396291006003-416
"Volume 6 Issue 3-4, September 1991",Book Review: The Business Value of Computers,https://journals.sagepub.com/doi/abs/10.1177/0268396291006003-417
"Volume 6 Issue 3-4, September 1991",Book Review: Up and Running Integrating Information Technology and the Organization,https://journals.sagepub.com/doi/abs/10.1177/0268396291006003-418
"Volume 6 Issue 3-4, September 1991",Office Information Systems. Management Issues and Methods,https://journals.sagepub.com/doi/abs/10.1177/0268396291006003-419
"Volume 6 Issue 3-4, September 1991",Shaping the Future. Business Design through Information Technology,https://journals.sagepub.com/doi/abs/10.1177/0268396291006003-420
"Volume 6 Issue 3-4, September 1991",Software Metrics. A Rigorous Approach,https://journals.sagepub.com/doi/abs/10.1177/0268396291006003-421
"Volume 6 Issue 3-4, September 1991",Project Management for Information Systems,https://journals.sagepub.com/doi/abs/10.1177/0268396291006003-422
"Volume 6 Issue 3-4, September 1991",Revolution in Real Time,https://journals.sagepub.com/doi/abs/10.1177/0268396291006003-423
"Volume 6 Issue 2, June 1991",Editorial,https://journals.sagepub.com/doi/abs/10.1177/026839629100600201
"Volume 6 Issue 2, June 1991",Parallels between Object-Oriented Software Development and Total Quality Management,https://journals.sagepub.com/doi/abs/10.1177/026839629100600202
"Volume 6 Issue 2, June 1991",A Survey of Requirements Verification Techniques,https://journals.sagepub.com/doi/abs/10.1177/026839629100600203
"Volume 6 Issue 2, June 1991",Global Information Systems: A Joint Venture between Business and Education,https://journals.sagepub.com/doi/abs/10.1177/026839629100600204
"Volume 6 Issue 2, June 1991",Current Use of Software Tools in the Development of Medical and Health Services Computer Applications – a Survey,https://journals.sagepub.com/doi/abs/10.1177/026839629100600205
"Volume 6 Issue 2, June 1991",Information Systems Strategies in Government: Recent Survey Evidence,https://journals.sagepub.com/doi/abs/10.1177/026839629100600206
"Volume 6 Issue 2, June 1991",Case Study: Implementing New Systems at Penguin Books,https://journals.sagepub.com/doi/abs/10.1177/026839629100600207
"Volume 6 Issue 2, June 1991",Case ‘90,https://journals.sagepub.com/doi/abs/10.1177/026839629100600208
"Volume 6 Issue 2, June 1991",Book Review: The Market and Beyond: Cooperation and Competition in Information Technology in the Japanese System,https://journals.sagepub.com/doi/abs/10.1177/026839629100600209
"Volume 6 Issue 2, June 1991",Book Review: Audit of Information Processing,https://journals.sagepub.com/doi/abs/10.1177/026839629100600210
"Volume 6 Issue 2, June 1991",Computer Systems Development,https://journals.sagepub.com/doi/abs/10.1177/026839629100600211
"Volume 6 Issue 2, June 1991",Managing Information,https://journals.sagepub.com/doi/abs/10.1177/026839629100600212
"Volume 6 Issue 2, June 1991",Women in Computing,https://journals.sagepub.com/doi/abs/10.1177/026839629100600213
"Volume 6 Issue 2, June 1991",New Technology,https://journals.sagepub.com/doi/abs/10.1177/026839629100600214
"Volume 6 Issue 2, June 1991",Theory and Practice of Relational Databases,https://journals.sagepub.com/doi/abs/10.1177/026839629100600215
"Volume 6 Issue 1, March 1991",Editorial,https://journals.sagepub.com/doi/abs/10.1177/026839629100600101
"Volume 6 Issue 1, March 1991",Software for Concise and Informative Project Management,https://journals.sagepub.com/doi/abs/10.1177/026839629100600102
"Volume 6 Issue 1, March 1991",Deriving Semantic Data Models from Structured Process Descriptions of Reality,https://journals.sagepub.com/doi/abs/10.1177/026839629100600103
"Volume 6 Issue 1, March 1991",Information Requirements Prototyping for Decision Support Systems,https://journals.sagepub.com/doi/abs/10.1177/026839629100600104
"Volume 6 Issue 1, March 1991",Experiments with Expert Systems in Management Education,https://journals.sagepub.com/doi/abs/10.1177/026839629100600105
"Volume 6 Issue 1, March 1991",Overcoming the Barriers to the Implementation of Information System Strategies,https://journals.sagepub.com/doi/abs/10.1177/026839629100600106
"Volume 6 Issue 1, March 1991",Developing a Management Culture in Which Information Technology will Flourish: How the UK Can Benefit,https://journals.sagepub.com/doi/abs/10.1177/026839629100600107
"Volume 6 Issue 1, March 1991",Transforming Organizations through Information Management,https://journals.sagepub.com/doi/abs/10.1177/026839629100600108
"Volume 6 Issue 1, March 1991",Book Review: Strategic Planning for Information Systems,https://journals.sagepub.com/doi/abs/10.1177/026839629100600109
"Volume 5 Issue 4, December 1990",This issue,https://journals.sagepub.com/doi/abs/10.1177/026839629000500401
"Volume 5 Issue 4, December 1990",Theme Issue: Introduction,https://journals.sagepub.com/doi/abs/10.1177/026839629000500402
"Volume 5 Issue 4, December 1990",Managing is Benefits for the 1990s,https://journals.sagepub.com/doi/abs/10.1177/026839629000500403
"Volume 5 Issue 4, December 1990",Evaluation of Information Systems: Is Development in the Processing Company,https://journals.sagepub.com/doi/abs/10.1177/026839629000500404
"Volume 5 Issue 4, December 1990",Beyond Strategy — Benefits Identification and Management of Specific IT Investments,https://journals.sagepub.com/doi/abs/10.1177/026839629000500405
"Volume 5 Issue 4, December 1990",Evaluating IT Investments — Matching Techniques to Projects,https://journals.sagepub.com/doi/abs/10.1177/026839629000500406
"Volume 5 Issue 4, December 1990",A Portfolio Approach to Evaluating Information Systems Investments and Setting Priorities,https://journals.sagepub.com/doi/abs/10.1177/026839629000500407
"Volume 5 Issue 4, December 1990",‘Hybrids’ - A Critical Force in the Application of Information Technology in the Nineties,https://journals.sagepub.com/doi/abs/10.1177/026839629000500408
"Volume 5 Issue 4, December 1990",People and Technology: How to Make Your IT Investment Work for You,https://journals.sagepub.com/doi/abs/10.1177/026839629000500409
"Volume 5 Issue 4, December 1990",Book Review: Maintaining Information Systems in Organizations,https://journals.sagepub.com/doi/abs/10.1177/026839629000500410
"Volume 5 Issue 4, December 1990",Author Index to Volume 5,https://journals.sagepub.com/doi/abs/10.1177/026839629000500411
"Volume 5 Issue 3, September 1990",Editorial,https://journals.sagepub.com/doi/abs/10.1177/026839629000500301
"Volume 5 Issue 3, September 1990",The Case Study: A Useful Research Method for Information Management,https://journals.sagepub.com/doi/abs/10.1177/026839629000500302
"Volume 5 Issue 3, September 1990",Information Systems Forensics,https://journals.sagepub.com/doi/abs/10.1177/026839629000500303
"Volume 5 Issue 3, September 1990",Soft Information Systems,https://journals.sagepub.com/doi/abs/10.1177/026839629000500304
"Volume 5 Issue 3, September 1990",Themes and Issues in An Information Polity,https://journals.sagepub.com/doi/abs/10.1177/026839629000500305
"Volume 5 Issue 3, September 1990",Teaching Information Systems to the Visually Handicapped — A Case History,https://journals.sagepub.com/doi/abs/10.1177/026839629000500306
"Volume 5 Issue 3, September 1990",Systems Thinking about Information Systems and Strategies,https://journals.sagepub.com/doi/abs/10.1177/026839629000500307
"Volume 5 Issue 3, September 1990",Creating a Business-Oriented IT Department,https://journals.sagepub.com/doi/abs/10.1177/026839629000500308
"Volume 5 Issue 3, September 1990",Book Review,https://journals.sagepub.com/doi/abs/10.1177/026839629000500309
"Volume 5 Issue 3, September 1990",Book Review: Audit Commission Management Papers Number 7. Preparing an Information Technology Strategy: Making IT Happen,https://journals.sagepub.com/doi/abs/10.1177/026839629000500310
"Volume 5 Issue 3, September 1990",Book Review: Beating the System,https://journals.sagepub.com/doi/abs/10.1177/026839629000500311
"Volume 5 Issue 2, June 1990",Editorial,https://journals.sagepub.com/doi/abs/10.1177/026839629000500201
"Volume 5 Issue 2, June 1990","Local Area Network Operations: A Security, Control and Audit Perspective",https://journals.sagepub.com/doi/abs/10.1177/026839629000500202
"Volume 5 Issue 2, June 1990",Information Systems Successes and Failures: Research Findings from the Compounding Industry,https://journals.sagepub.com/doi/abs/10.1177/026839629000500203
"Volume 5 Issue 2, June 1990",Organizational Principles of Systems Decentralization,https://journals.sagepub.com/doi/abs/10.1177/026839629000500204
"Volume 5 Issue 2, June 1990",The Design of a Knowledge Communication Shell,https://journals.sagepub.com/doi/abs/10.1177/026839629000500205
"Volume 5 Issue 2, June 1990",A Process Model for Software Maintenance,https://journals.sagepub.com/doi/abs/10.1177/026839629000500206
